NameLesson,NameCourse,Description
harness revolutionary synergies,Sales,Nulla tellus.
orchestrate user-centric interfaces,Business Development,Curabitur in libero ut massa volutpat convallis.
deploy next-generation web-readiness,Accounting,Integer ac neque.
productize efficient systems,Legal,Morbi a ipsum.
productize robust interfaces,Engineering,Etiam justo.
enhance granular content,Support,Vestibulum sed magna at nunc commodo placerat.
e-enable extensible architectures,Services,Curabitur convallis.
enable cross-media e-tailers,Services,Nulla suscipit ligula in lacus. Curabitur at ipsum ac tellus semper interdum.
implement impactful bandwidth,Legal,Nulla tempus. Vivamus in felis eu sapien cursus vestibulum.
envisioneer value-added initiatives,Marketing,"In hac habitasse platea dictumst. Aliquam augue quam, sollicitudin vitae, consectetuer eget, rutrum at, lorem."
implement turn-key e-services,Marketing,Nulla ut erat id mauris vulputate elementum. Nullam varius.
expedite open-source e-markets,Sales,"Morbi ut odio. Cras mi pede, malesuada in, imperdiet et, commodo vulputate, justo."
iterate collaborative models,Legal,"In blandit ultrices enim. Lorem ipsum dolor sit amet, consectetuer adipiscing elit."
facilitate vertical niches,Marketing,Integer a nibh.
enable global web services,Legal,"Donec odio justo, sollicitudin ut, suscipit a, feugiat et, eros."
deliver best-of-breed interfaces,Training,"Sed sagittis. Nam congue, risus semper porta volutpat, quam pede lobortis ligula, sit amet eleifend pede libero quis orci."
unleash user-centric ROI,Human Resources,"Morbi vel lectus in quam fringilla rhoncus. Mauris enim leo, rhoncus sed, vestibulum sit amet, cursus id, turpis."
monetize scalable schemas,Support,Quisque id justo sit amet sapien dignissim vestibulum. Vestibulum ante ipsum primis in faucibus orci luctus et ultrices posuere cubilia Curae; Nulla dapibus dolor vel est.
mesh efficient e-commerce,Research and Development,Sed ante. Vivamus tortor.
grow one-to-one portals,Training,Aenean auctor gravida sem. Praesent id massa id nisl venenatis lacinia.
incubate 24/7 e-commerce,Support,Aenean lectus. Pellentesque eget nunc.
envisioneer world-class channels,Support,Fusce consequat. Nulla nisl.
iterate B2B e-tailers,Services,"In hac habitasse platea dictumst. Morbi vestibulum, velit id pretium iaculis, diam erat fermentum justo, nec condimentum neque sapien placerat ante."
unleash strategic web-readiness,Marketing,Praesent blandit. Nam nulla.
integrate granular deliverables,Marketing,Vestibulum sed magna at nunc commodo placerat.
repurpose cross-platform platforms,Business Development,"In hac habitasse platea dictumst. Morbi vestibulum, velit id pretium iaculis, diam erat fermentum justo, nec condimentum neque sapien placerat ante."
deploy bleeding-edge supply-chains,Marketing,Maecenas rhoncus aliquam lacus. Morbi quis tortor id nulla ultrices aliquet.
incentivize synergistic e-tailers,Legal,Nullam porttitor lacus at turpis. Donec posuere metus vitae ipsum.
scale extensible action-items,Services,Cras non velit nec nisi vulputate nonummy.
embrace seamless portals,Services,Integer ac neque. Duis bibendum.
enhance collaborative users,Sales,"Maecenas tristique, est et tempus semper, est quam pharetra magna, ac consequat metus sapien ut nunc."
incentivize B2C supply-chains,Business Development,"Lorem ipsum dolor sit amet, consectetuer adipiscing elit."
unleash impactful networks,Human Resources,In congue. Etiam justo.
evolve leading-edge bandwidth,Legal,Integer ac leo.
cultivate cutting-edge channels,Product Management,Maecenas rhoncus aliquam lacus.
facilitate killer content,Services,Nulla justo.
scale turn-key e-services,Support,Sed sagittis.
leverage bleeding-edge markets,Support,"In est risus, auctor sed, tristique in, tempus sit amet, sem. Fusce consequat."
mesh B2C initiatives,Engineering,Quisque ut erat.
enable efficient portals,Human Resources,Nullam porttitor lacus at turpis. Donec posuere metus vitae ipsum.
transition user-centric portals,Training,Proin risus. Praesent lectus.
deliver impactful paradigms,Legal,"Fusce congue, diam id ornare imperdiet, sapien urna pretium nisl, ut volutpat sapien arcu sed augue. Aliquam erat volutpat."
seize e-business networks,Business Development,Maecenas rhoncus aliquam lacus. Morbi quis tortor id nulla ultrices aliquet.
generate real-time e-commerce,Accounting,Vivamus in felis eu sapien cursus vestibulum. Proin eu mi.
syndicate dynamic mindshare,Product Management,Nulla suscipit ligula in lacus. Curabitur at ipsum ac tellus semper interdum.
whiteboard open-source partnerships,Accounting,Pellentesque ultrices mattis odio.
innovate out-of-the-box systems,Services,Ut tellus.
integrate real-time applications,Support,Integer ac leo. Pellentesque ultrices mattis odio.
facilitate back-end portals,Legal,"Cras in purus eu magna vulputate luctus. Cum sociis natoque penatibus et magnis dis parturient montes, nascetur ridiculus mus."
engage killer convergence,Marketing,Aliquam sit amet diam in magna bibendum imperdiet.
orchestrate extensible eyeballs,Support,"Morbi ut odio. Cras mi pede, malesuada in, imperdiet et, commodo vulputate, justo."
reintermediate front-end e-tailers,Research and Development,Nunc purus.
brand end-to-end ROI,Product Management,Nunc nisl.
evolve best-of-breed e-markets,Accounting,Integer non velit.
recontextualize intuitive initiatives,Legal,Suspendisse ornare consequat lectus.
incentivize global infrastructures,Engineering,"Nulla neque libero, convallis eget, eleifend luctus, ultricies eu, nibh. Quisque id justo sit amet sapien dignissim vestibulum."
grow killer technologies,Human Resources,In hac habitasse platea dictumst. Maecenas ut massa quis augue luctus tincidunt.
morph distributed action-items,Accounting,Aenean auctor gravida sem. Praesent id massa id nisl venenatis lacinia.
evolve ubiquitous markets,Engineering,In hac habitasse platea dictumst.
unleash efficient synergies,Sales,"Integer aliquet, massa id lobortis convallis, tortor risus dapibus augue, vel accumsan tellus nisi eu orci."
benchmark extensible markets,Support,Vestibulum ante ipsum primis in faucibus orci luctus et ultrices posuere cubilia Curae; Mauris viverra diam vitae quam.
brand user-centric eyeballs,Product Management,Donec dapibus. Duis at velit eu est congue elementum.
monetize open-source e-commerce,Research and Development,Vestibulum sed magna at nunc commodo placerat. Praesent blandit.
incentivize strategic e-business,Sales,Duis consequat dui nec nisi volutpat eleifend. Donec ut dolor.
visualize compelling e-services,Research and Development,Ut at dolor quis odio consequat varius.
reintermediate web-enabled e-business,Legal,"Morbi sem mauris, laoreet ut, rhoncus aliquet, pulvinar sed, nisl. Nunc rhoncus dui vel sem."
facilitate seamless e-commerce,Services,Ut tellus.
deploy clicks-and-mortar relationships,Product Management,Morbi non lectus. Aliquam sit amet diam in magna bibendum imperdiet.
maximize virtual portals,Research and Development,"Proin leo odio, porttitor id, consequat in, consequat ut, nulla."
reinvent extensible architectures,Support,Vestibulum rutrum rutrum neque.
drive best-of-breed infomediaries,Marketing,Ut tellus. Nulla ut erat id mauris vulputate elementum.
unleash revolutionary portals,Product Management,Cras non velit nec nisi vulputate nonummy. Maecenas tincidunt lacus at velit.
incentivize magnetic technologies,Training,Phasellus in felis.
mesh out-of-the-box architectures,Marketing,"Nulla ac enim. In tempor, turpis nec euismod scelerisque, quam turpis adipiscing lorem, vitae mattis nibh ligula nec sem."
grow impactful convergence,Support,Nulla suscipit ligula in lacus.
maximize transparent e-tailers,Legal,Vestibulum ante ipsum primis in faucibus orci luctus et ultrices posuere cubilia Curae; Duis faucibus accumsan odio.
transform sexy synergies,Business Development,"Fusce lacus purus, aliquet at, feugiat non, pretium quis, lectus."
brand back-end web-readiness,Accounting,Nullam varius. Nulla facilisi.
harness intuitive initiatives,Support,Etiam vel augue. Vestibulum rutrum rutrum neque.
productize front-end infrastructures,Sales,Nulla nisl.
drive scalable channels,Support,Suspendisse accumsan tortor quis turpis. Sed ante.
reintermediate user-centric technologies,Legal,Nullam varius. Nulla facilisi.
recontextualize frictionless relationships,Sales,"Morbi sem mauris, laoreet ut, rhoncus aliquet, pulvinar sed, nisl. Nunc rhoncus dui vel sem."
architect integrated channels,Marketing,Vivamus vel nulla eget eros elementum pellentesque.
reinvent world-class infrastructures,Research and Development,Ut tellus. Nulla ut erat id mauris vulputate elementum.
transition dynamic e-business,Business Development,Nullam varius.
brand web-enabled e-commerce,Services,"Nam dui. Proin leo odio, porttitor id, consequat in, consequat ut, nulla."
syndicate magnetic e-business,Legal,"Nunc nisl. Duis bibendum, felis sed interdum venenatis, turpis enim blandit mi, in porttitor pede justo eu massa."
disintermediate global partnerships,Services,Nunc purus.
morph 24/7 schemas,Research and Development,Etiam faucibus cursus urna.
streamline interactive technologies,Engineering,"Cum sociis natoque penatibus et magnis dis parturient montes, nascetur ridiculus mus."
incubate 24/365 web services,Research and Development,Nulla nisl.
unleash killer ROI,Human Resources,"Integer pede justo, lacinia eget, tincidunt eget, tempus vel, pede. Morbi porttitor lorem id ligula."
leverage cross-platform architectures,Human Resources,"In hac habitasse platea dictumst. Aliquam augue quam, sollicitudin vitae, consectetuer eget, rutrum at, lorem."
drive extensible vortals,Business Development,Proin eu mi. Nulla ac enim.
matrix customized web services,Support,"Nullam orci pede, venenatis non, sodales sed, tincidunt eu, felis. Fusce posuere felis sed lacus."
deliver enterprise relationships,Product Management,Vivamus in felis eu sapien cursus vestibulum. Proin eu mi.
scale innovative architectures,Product Management,"Vivamus vestibulum sagittis sapien. Cum sociis natoque penatibus et magnis dis parturient montes, nascetur ridiculus mus."
brand next-generation experiences,Human Resources,Integer ac leo. Pellentesque ultrices mattis odio.
scale world-class functionalities,Marketing,Duis mattis egestas metus.
innovate virtual infomediaries,Services,"Nullam orci pede, venenatis non, sodales sed, tincidunt eu, felis."
extend B2C vortals,Human Resources,Curabitur in libero ut massa volutpat convallis.
facilitate ubiquitous schemas,Training,Donec posuere metus vitae ipsum. Aliquam non mauris.
mesh rich infrastructures,Marketing,Maecenas ut massa quis augue luctus tincidunt.
e-enable proactive e-tailers,Sales,"Morbi odio odio, elementum eu, interdum eu, tincidunt in, leo. Maecenas pulvinar lobortis est."
disintermediate global content,Engineering,Morbi quis tortor id nulla ultrices aliquet.
optimize vertical models,Product Management,Quisque id justo sit amet sapien dignissim vestibulum.
recontextualize dynamic technologies,Marketing,Phasellus id sapien in sapien iaculis congue.
deploy B2B portals,Support,Integer tincidunt ante vel ipsum.
integrate e-business content,Product Management,Integer ac leo.
seize cutting-edge web services,Services,"Vestibulum ante ipsum primis in faucibus orci luctus et ultrices posuere cubilia Curae; Donec pharetra, magna vestibulum aliquet ultrices, erat tortor sollicitudin mi, sit amet lobortis sapien sapien non mi."
engage rich systems,Sales,In hac habitasse platea dictumst.
scale distributed mindshare,Sales,Duis ac nibh.
e-enable mission-critical platforms,Research and Development,"Vivamus vestibulum sagittis sapien. Cum sociis natoque penatibus et magnis dis parturient montes, nascetur ridiculus mus."
leverage leading-edge markets,Research and Development,Suspendisse potenti.
disintermediate ubiquitous functionalities,Legal,Pellentesque viverra pede ac diam. Cras pellentesque volutpat dui.
recontextualize efficient ROI,Product Management,Sed vel enim sit amet nunc viverra dapibus.
syndicate end-to-end ROI,Accounting,In hac habitasse platea dictumst.
mesh compelling interfaces,Research and Development,Nulla nisl. Nunc nisl.
incentivize rich platforms,Services,Ut tellus. Nulla ut erat id mauris vulputate elementum.
harness value-added vortals,Training,Pellentesque ultrices mattis odio. Donec vitae nisi.
mesh scalable vortals,Product Management,"Integer non velit. Donec diam neque, vestibulum eget, vulputate ut, ultrices vel, augue."
matrix mission-critical e-markets,Business Development,"Cras mi pede, malesuada in, imperdiet et, commodo vulputate, justo."
envisioneer integrated convergence,Services,Integer ac leo.
recontextualize cutting-edge supply-chains,Business Development,"Quisque arcu libero, rutrum ac, lobortis vel, dapibus at, diam. Nam tristique tortor eu pede."
architect vertical channels,Marketing,Fusce posuere felis sed lacus.
embrace leading-edge systems,Engineering,Integer a nibh. In quis justo.
aggregate open-source deliverables,Training,Proin at turpis a pede posuere nonummy.
matrix best-of-breed deliverables,Marketing,Duis ac nibh.
expedite one-to-one models,Sales,"Nam congue, risus semper porta volutpat, quam pede lobortis ligula, sit amet eleifend pede libero quis orci. Nullam molestie nibh in lectus."
maximize proactive channels,Product Management,Ut at dolor quis odio consequat varius. Integer ac leo.
morph scalable synergies,Human Resources,"Integer pede justo, lacinia eget, tincidunt eget, tempus vel, pede."
exploit user-centric relationships,Support,Etiam justo. Etiam pretium iaculis justo.
revolutionize plug-and-play infrastructures,Support,"Praesent lectus. Vestibulum quam sapien, varius ut, blandit non, interdum in, ante."
leverage B2B markets,Accounting,Donec semper sapien a libero.
reinvent real-time users,Engineering,"Nunc nisl. Duis bibendum, felis sed interdum venenatis, turpis enim blandit mi, in porttitor pede justo eu massa."
recontextualize interactive bandwidth,Engineering,Morbi ut odio.
synergize cross-media eyeballs,Legal,Integer a nibh.
synthesize granular solutions,Marketing,Etiam pretium iaculis justo. In hac habitasse platea dictumst.
harness ubiquitous experiences,Business Development,Morbi non quam nec dui luctus rutrum.
strategize bricks-and-clicks interfaces,Accounting,In hac habitasse platea dictumst. Etiam faucibus cursus urna.
deploy collaborative ROI,Accounting,Maecenas ut massa quis augue luctus tincidunt.
mesh back-end systems,Engineering,Etiam vel augue.
streamline efficient niches,Legal,Phasellus sit amet erat.
deliver transparent functionalities,Services,Proin interdum mauris non ligula pellentesque ultrices.
incubate dot-com paradigms,Training,"Maecenas tristique, est et tempus semper, est quam pharetra magna, ac consequat metus sapien ut nunc. Vestibulum ante ipsum primis in faucibus orci luctus et ultrices posuere cubilia Curae; Mauris viverra diam vitae quam."
streamline visionary supply-chains,Research and Development,Donec posuere metus vitae ipsum.
envisioneer efficient networks,Research and Development,Curabitur gravida nisi at nibh.
mesh collaborative supply-chains,Training,Aliquam erat volutpat. In congue.
repurpose e-business e-services,Support,"Donec diam neque, vestibulum eget, vulputate ut, ultrices vel, augue."
utilize robust deliverables,Business Development,Maecenas rhoncus aliquam lacus.
redefine innovative portals,Business Development,"Donec vitae nisi. Nam ultrices, libero non mattis pulvinar, nulla pede ullamcorper augue, a suscipit nulla elit ac nulla."
streamline proactive vortals,Services,Integer tincidunt ante vel ipsum. Praesent blandit lacinia erat.
engineer seamless applications,Legal,Duis bibendum. Morbi non quam nec dui luctus rutrum.
evolve leading-edge vortals,Legal,"In est risus, auctor sed, tristique in, tempus sit amet, sem. Fusce consequat."
benchmark impactful models,Marketing,"Vivamus metus arcu, adipiscing molestie, hendrerit at, vulputate vitae, nisl. Aenean lectus."
optimize bleeding-edge ROI,Legal,Duis mattis egestas metus. Aenean fermentum.
deliver dot-com technologies,Accounting,In eleifend quam a odio. In hac habitasse platea dictumst.
syndicate synergistic applications,Services,Duis bibendum.
morph sticky infomediaries,Training,"Morbi sem mauris, laoreet ut, rhoncus aliquet, pulvinar sed, nisl. Nunc rhoncus dui vel sem."
benchmark front-end systems,Services,"Vivamus metus arcu, adipiscing molestie, hendrerit at, vulputate vitae, nisl. Aenean lectus."
repurpose user-centric channels,Accounting,"Proin leo odio, porttitor id, consequat in, consequat ut, nulla. Sed accumsan felis."
mesh scalable platforms,Support,"Cras in purus eu magna vulputate luctus. Cum sociis natoque penatibus et magnis dis parturient montes, nascetur ridiculus mus."
generate next-generation vortals,Sales,Nullam molestie nibh in lectus.
recontextualize killer relationships,Services,"Integer aliquet, massa id lobortis convallis, tortor risus dapibus augue, vel accumsan tellus nisi eu orci."
empower cutting-edge deliverables,Accounting,Cras non velit nec nisi vulputate nonummy. Maecenas tincidunt lacus at velit.
exploit cross-platform web-readiness,Business Development,Morbi quis tortor id nulla ultrices aliquet.
scale strategic platforms,Marketing,Vivamus tortor.
disintermediate clicks-and-mortar web services,Accounting,Nulla suscipit ligula in lacus. Curabitur at ipsum ac tellus semper interdum.
seize value-added convergence,Marketing,Phasellus id sapien in sapien iaculis congue.
brand scalable functionalities,Product Management,Vivamus vestibulum sagittis sapien.
leverage holistic e-markets,Marketing,"Maecenas tristique, est et tempus semper, est quam pharetra magna, ac consequat metus sapien ut nunc. Vestibulum ante ipsum primis in faucibus orci luctus et ultrices posuere cubilia Curae; Mauris viverra diam vitae quam."
optimize killer bandwidth,Accounting,Vivamus tortor.
productize vertical infomediaries,Marketing,Suspendisse potenti.
utilize global systems,Sales,Nulla tempus. Vivamus in felis eu sapien cursus vestibulum.
e-enable bricks-and-clicks networks,Marketing,Vestibulum ante ipsum primis in faucibus orci luctus et ultrices posuere cubilia Curae; Nulla dapibus dolor vel est.
exploit sexy paradigms,Marketing,Quisque id justo sit amet sapien dignissim vestibulum. Vestibulum ante ipsum primis in faucibus orci luctus et ultrices posuere cubilia Curae; Nulla dapibus dolor vel est.
recontextualize interactive e-markets,Product Management,Praesent id massa id nisl venenatis lacinia.
generate sexy web-readiness,Training,Curabitur gravida nisi at nibh.
exploit strategic communities,Accounting,Maecenas pulvinar lobortis est.
scale out-of-the-box infomediaries,Training,Praesent id massa id nisl venenatis lacinia. Aenean sit amet justo.
empower synergistic vortals,Support,Aliquam non mauris. Morbi non lectus.
synergize intuitive architectures,Legal,Nulla ac enim.
utilize back-end paradigms,Research and Development,"Maecenas leo odio, condimentum id, luctus nec, molestie sed, justo."
enable seamless mindshare,Accounting,Phasellus sit amet erat. Nulla tempus.
aggregate out-of-the-box mindshare,Business Development,Nulla ut erat id mauris vulputate elementum.
recontextualize frictionless architectures,Sales,"Nam nulla. Integer pede justo, lacinia eget, tincidunt eget, tempus vel, pede."
integrate ubiquitous interfaces,Product Management,Integer tincidunt ante vel ipsum.
harness e-business synergies,Human Resources,Nullam porttitor lacus at turpis. Donec posuere metus vitae ipsum.
streamline visionary supply-chains,Legal,"In est risus, auctor sed, tristique in, tempus sit amet, sem. Fusce consequat."
unleash next-generation vortals,Research and Development,Aliquam non mauris.
optimize innovative systems,Product Management,Proin at turpis a pede posuere nonummy. Integer non velit.
revolutionize one-to-one architectures,Accounting,Donec dapibus.
architect intuitive functionalities,Engineering,"Phasellus id sapien in sapien iaculis congue. Vivamus metus arcu, adipiscing molestie, hendrerit at, vulputate vitae, nisl."
unleash B2C e-markets,Support,"Vivamus metus arcu, adipiscing molestie, hendrerit at, vulputate vitae, nisl."
deliver global paradigms,Engineering,Pellentesque ultrices mattis odio.
enable cross-platform solutions,Product Management,"Vestibulum ac est lacinia nisi venenatis tristique. Fusce congue, diam id ornare imperdiet, sapien urna pretium nisl, ut volutpat sapien arcu sed augue."
reintermediate distributed systems,Human Resources,"Vivamus metus arcu, adipiscing molestie, hendrerit at, vulputate vitae, nisl. Aenean lectus."
drive 24/7 action-items,Services,Nunc purus. Phasellus in felis.
exploit integrated methodologies,Human Resources,Nunc nisl.
reintermediate efficient methodologies,Accounting,"Morbi sem mauris, laoreet ut, rhoncus aliquet, pulvinar sed, nisl. Nunc rhoncus dui vel sem."
embrace virtual infrastructures,Research and Development,"Nullam orci pede, venenatis non, sodales sed, tincidunt eu, felis. Fusce posuere felis sed lacus."
facilitate viral models,Support,In hac habitasse platea dictumst.
architect B2C content,Product Management,Proin eu mi.
harness transparent eyeballs,Marketing,"Proin leo odio, porttitor id, consequat in, consequat ut, nulla. Sed accumsan felis."
drive virtual web services,Research and Development,Etiam faucibus cursus urna. Ut tellus.
leverage real-time e-tailers,Engineering,Suspendisse potenti. In eleifend quam a odio.
recontextualize transparent schemas,Accounting,Integer non velit.
morph B2C infrastructures,Business Development,Duis bibendum. Morbi non quam nec dui luctus rutrum.
syndicate magnetic niches,Engineering,Donec vitae nisi.
innovate compelling e-tailers,Services,Vivamus vel nulla eget eros elementum pellentesque.
expedite revolutionary systems,Legal,"Nunc nisl. Duis bibendum, felis sed interdum venenatis, turpis enim blandit mi, in porttitor pede justo eu massa."
transform cross-platform e-markets,Human Resources,"Quisque erat eros, viverra eget, congue eget, semper rutrum, nulla. Nunc purus."
exploit e-business architectures,Legal,"Nam congue, risus semper porta volutpat, quam pede lobortis ligula, sit amet eleifend pede libero quis orci. Nullam molestie nibh in lectus."
grow plug-and-play platforms,Sales,Morbi quis tortor id nulla ultrices aliquet.
productize extensible systems,Sales,"Morbi quis tortor id nulla ultrices aliquet. Maecenas leo odio, condimentum id, luctus nec, molestie sed, justo."
evolve granular networks,Business Development,Nulla mollis molestie lorem. Quisque ut erat.
disintermediate frictionless experiences,Marketing,In sagittis dui vel nisl. Duis ac nibh.
deliver revolutionary e-commerce,Legal,In hac habitasse platea dictumst.
incentivize killer systems,Accounting,Nullam varius.
incentivize virtual partnerships,Sales,Etiam vel augue.
mesh visionary networks,Human Resources,Sed ante. Vivamus tortor.
benchmark cross-platform technologies,Support,Integer ac neque. Duis bibendum.
extend open-source partnerships,Human Resources,"Lorem ipsum dolor sit amet, consectetuer adipiscing elit."
exploit value-added functionalities,Product Management,Suspendisse potenti.
leverage 24/365 e-services,Support,Vivamus vel nulla eget eros elementum pellentesque. Quisque porta volutpat erat.
visualize proactive e-services,Sales,"Nam congue, risus semper porta volutpat, quam pede lobortis ligula, sit amet eleifend pede libero quis orci."
empower sexy convergence,Sales,Morbi a ipsum.
engineer 24/365 networks,Human Resources,Vivamus tortor. Duis mattis egestas metus.
matrix holistic communities,Sales,Curabitur at ipsum ac tellus semper interdum.
cultivate vertical action-items,Sales,Proin eu mi. Nulla ac enim.
benchmark granular portals,Business Development,Etiam justo. Etiam pretium iaculis justo.
extend global mindshare,Product Management,Nam nulla.
integrate dynamic content,Services,"Nulla ac enim. In tempor, turpis nec euismod scelerisque, quam turpis adipiscing lorem, vitae mattis nibh ligula nec sem."
optimize out-of-the-box channels,Services,Integer ac leo.
aggregate 24/365 methodologies,Legal,Duis aliquam convallis nunc.
deliver value-added markets,Support,Donec dapibus. Duis at velit eu est congue elementum.
target strategic niches,Research and Development,Aliquam quis turpis eget elit sodales scelerisque.
iterate leading-edge paradigms,Research and Development,Phasellus sit amet erat. Nulla tempus.
harness bleeding-edge e-business,Training,"Nam nulla. Integer pede justo, lacinia eget, tincidunt eget, tempus vel, pede."
streamline killer architectures,Sales,Nunc purus.
target back-end communities,Training,Proin interdum mauris non ligula pellentesque ultrices.
harness leading-edge applications,Product Management,Suspendisse potenti.
facilitate next-generation e-services,Engineering,Maecenas pulvinar lobortis est.
engineer out-of-the-box architectures,Business Development,Morbi a ipsum.
empower integrated deliverables,Human Resources,Suspendisse ornare consequat lectus.
repurpose compelling experiences,Accounting,Morbi a ipsum.
enhance holistic systems,Training,"Integer aliquet, massa id lobortis convallis, tortor risus dapibus augue, vel accumsan tellus nisi eu orci."
enhance user-centric ROI,Product Management,Sed sagittis.
leverage end-to-end markets,Business Development,"Maecenas tristique, est et tempus semper, est quam pharetra magna, ac consequat metus sapien ut nunc. Vestibulum ante ipsum primis in faucibus orci luctus et ultrices posuere cubilia Curae; Mauris viverra diam vitae quam."
matrix customized ROI,Services,Integer ac neque.
synthesize proactive models,Training,"Maecenas tristique, est et tempus semper, est quam pharetra magna, ac consequat metus sapien ut nunc."
iterate cutting-edge web services,Legal,Aliquam quis turpis eget elit sodales scelerisque.
innovate holistic architectures,Marketing,"Nullam orci pede, venenatis non, sodales sed, tincidunt eu, felis. Fusce posuere felis sed lacus."
