NameLesson,NameCourse,Description
benchmark bleeding-edge networks,Product Management,"Duis bibendum, felis sed interdum venenatis, turpis enim blandit mi, in porttitor pede justo eu massa. Donec dapibus."
drive granular communities,Support,Quisque ut erat. Curabitur gravida nisi at nibh.
benchmark dynamic channels,Product Management,Pellentesque ultrices mattis odio.
transform leading-edge vortals,Product Management,Nullam molestie nibh in lectus.
streamline viral supply-chains,Business Development,Suspendisse potenti. Nullam porttitor lacus at turpis.
seize rich solutions,Marketing,Vestibulum sed magna at nunc commodo placerat.
synthesize plug-and-play initiatives,Legal,Donec semper sapien a libero.
matrix compelling relationships,Legal,Vestibulum ante ipsum primis in faucibus orci luctus et ultrices posuere cubilia Curae; Duis faucibus accumsan odio.
generate ubiquitous bandwidth,Training,Vestibulum ante ipsum primis in faucibus orci luctus et ultrices posuere cubilia Curae; Mauris viverra diam vitae quam.
incentivize efficient solutions,Sales,"Praesent lectus. Vestibulum quam sapien, varius ut, blandit non, interdum in, ante."
envisioneer turn-key functionalities,Support,Ut at dolor quis odio consequat varius.
recontextualize turn-key systems,Business Development,Morbi non quam nec dui luctus rutrum.
strategize cross-platform partnerships,Research and Development,Praesent blandit lacinia erat. Vestibulum sed magna at nunc commodo placerat.
maximize transparent partnerships,Product Management,Curabitur convallis. Duis consequat dui nec nisi volutpat eleifend.
optimize granular communities,Support,"Vestibulum ac est lacinia nisi venenatis tristique. Fusce congue, diam id ornare imperdiet, sapien urna pretium nisl, ut volutpat sapien arcu sed augue."
integrate cross-media relationships,Services,"Nunc nisl. Duis bibendum, felis sed interdum venenatis, turpis enim blandit mi, in porttitor pede justo eu massa."
productize B2B action-items,Product Management,Morbi non lectus. Aliquam sit amet diam in magna bibendum imperdiet.
matrix frictionless systems,Sales,"Vestibulum ante ipsum primis in faucibus orci luctus et ultrices posuere cubilia Curae; Donec pharetra, magna vestibulum aliquet ultrices, erat tortor sollicitudin mi, sit amet lobortis sapien sapien non mi. Integer ac neque."
repurpose dynamic e-business,Business Development,"In est risus, auctor sed, tristique in, tempus sit amet, sem. Fusce consequat."
leverage enterprise e-business,Training,Donec semper sapien a libero. Nam dui.
enhance rich bandwidth,Marketing,Aliquam erat volutpat.
monetize strategic web services,Engineering,Vivamus in felis eu sapien cursus vestibulum.
transform real-time solutions,Research and Development,Nunc purus.
benchmark sexy models,Sales,Duis mattis egestas metus. Aenean fermentum.
transform plug-and-play content,Business Development,Nunc nisl.
deliver world-class users,Business Development,Cras non velit nec nisi vulputate nonummy. Maecenas tincidunt lacus at velit.
incubate bleeding-edge e-tailers,Services,"Cras in purus eu magna vulputate luctus. Cum sociis natoque penatibus et magnis dis parturient montes, nascetur ridiculus mus."
incubate extensible mindshare,Marketing,Nam tristique tortor eu pede.
leverage 24/7 web-readiness,Accounting,"Fusce posuere felis sed lacus. Morbi sem mauris, laoreet ut, rhoncus aliquet, pulvinar sed, nisl."
mesh bricks-and-clicks mindshare,Support,Aenean auctor gravida sem.
disintermediate synergistic markets,Sales,"Aliquam augue quam, sollicitudin vitae, consectetuer eget, rutrum at, lorem. Integer tincidunt ante vel ipsum."
transition open-source networks,Business Development,"Nulla neque libero, convallis eget, eleifend luctus, ultricies eu, nibh. Quisque id justo sit amet sapien dignissim vestibulum."
enable dot-com systems,Support,Suspendisse potenti.
mesh extensible web services,Business Development,Proin risus. Praesent lectus.
transition innovative partnerships,Accounting,"Quisque arcu libero, rutrum ac, lobortis vel, dapibus at, diam."
reintermediate plug-and-play partnerships,Marketing,In hac habitasse platea dictumst. Etiam faucibus cursus urna.
matrix robust e-markets,Human Resources,Morbi quis tortor id nulla ultrices aliquet.
incentivize rich methodologies,Human Resources,In sagittis dui vel nisl. Duis ac nibh.
innovate killer web-readiness,Services,Duis bibendum.
implement global paradigms,Sales,"Quisque porta volutpat erat. Quisque erat eros, viverra eget, congue eget, semper rutrum, nulla."
iterate visionary users,Product Management,Sed ante. Vivamus tortor.
facilitate cutting-edge schemas,Business Development,Nulla ut erat id mauris vulputate elementum.
productize efficient e-business,Business Development,"Nam nulla. Integer pede justo, lacinia eget, tincidunt eget, tempus vel, pede."
engineer dynamic e-markets,Engineering,"In blandit ultrices enim. Lorem ipsum dolor sit amet, consectetuer adipiscing elit."
recontextualize value-added web services,Sales,"Nam ultrices, libero non mattis pulvinar, nulla pede ullamcorper augue, a suscipit nulla elit ac nulla."
engage vertical applications,Sales,Aenean fermentum.
generate synergistic platforms,Marketing,Donec posuere metus vitae ipsum. Aliquam non mauris.
harness revolutionary methodologies,Sales,Nullam varius. Nulla facilisi.
repurpose e-business technologies,Business Development,Pellentesque at nulla. Suspendisse potenti.
incentivize killer supply-chains,Product Management,Etiam vel augue.
iterate ubiquitous interfaces,Legal,"Vestibulum ante ipsum primis in faucibus orci luctus et ultrices posuere cubilia Curae; Nulla dapibus dolor vel est. Donec odio justo, sollicitudin ut, suscipit a, feugiat et, eros."
synthesize cross-media ROI,Support,Integer tincidunt ante vel ipsum.
incubate collaborative mindshare,Marketing,Nullam sit amet turpis elementum ligula vehicula consequat.
synthesize e-business functionalities,Human Resources,Integer non velit.
matrix revolutionary supply-chains,Marketing,"Donec odio justo, sollicitudin ut, suscipit a, feugiat et, eros. Vestibulum ac est lacinia nisi venenatis tristique."
transition cutting-edge web services,Human Resources,"Lorem ipsum dolor sit amet, consectetuer adipiscing elit."
facilitate back-end partnerships,Legal,Aenean sit amet justo. Morbi ut odio.
leverage back-end infrastructures,Human Resources,"Fusce lacus purus, aliquet at, feugiat non, pretium quis, lectus."
facilitate enterprise infomediaries,Support,Duis consequat dui nec nisi volutpat eleifend.
benchmark 24/7 niches,Accounting,"Integer pede justo, lacinia eget, tincidunt eget, tempus vel, pede."
drive turn-key e-commerce,Accounting,Duis bibendum.
drive proactive eyeballs,Marketing,Etiam faucibus cursus urna.
revolutionize vertical infrastructures,Support,Nullam varius. Nulla facilisi.
enhance real-time networks,Legal,"Integer pede justo, lacinia eget, tincidunt eget, tempus vel, pede. Morbi porttitor lorem id ligula."
syndicate virtual partnerships,Human Resources,Vivamus tortor. Duis mattis egestas metus.
harness wireless e-services,Training,Aenean sit amet justo.
redefine clicks-and-mortar platforms,Training,Nulla facilisi. Cras non velit nec nisi vulputate nonummy.
target rich interfaces,Business Development,"Cras in purus eu magna vulputate luctus. Cum sociis natoque penatibus et magnis dis parturient montes, nascetur ridiculus mus."
seize efficient portals,Engineering,"Nulla neque libero, convallis eget, eleifend luctus, ultricies eu, nibh."
synergize impactful ROI,Services,Morbi a ipsum.
optimize cutting-edge relationships,Human Resources,Curabitur at ipsum ac tellus semper interdum.
reinvent intuitive paradigms,Accounting,Vestibulum ante ipsum primis in faucibus orci luctus et ultrices posuere cubilia Curae; Duis faucibus accumsan odio.
generate real-time action-items,Engineering,Cras pellentesque volutpat dui.
disintermediate innovative markets,Sales,"Proin leo odio, porttitor id, consequat in, consequat ut, nulla. Sed accumsan felis."
grow cutting-edge channels,Legal,Aenean auctor gravida sem. Praesent id massa id nisl venenatis lacinia.
whiteboard user-centric models,Product Management,"Lorem ipsum dolor sit amet, consectetuer adipiscing elit."
redefine compelling convergence,Legal,Integer ac leo. Pellentesque ultrices mattis odio.
engage e-business functionalities,Human Resources,Vestibulum sed magna at nunc commodo placerat. Praesent blandit.
deploy 24/365 experiences,Product Management,"Mauris enim leo, rhoncus sed, vestibulum sit amet, cursus id, turpis."
revolutionize dot-com architectures,Business Development,In congue. Etiam justo.
enable dynamic deliverables,Services,"Integer aliquet, massa id lobortis convallis, tortor risus dapibus augue, vel accumsan tellus nisi eu orci. Mauris lacinia sapien quis libero."
harness mission-critical infrastructures,Product Management,Nulla ac enim.
visualize cross-media platforms,Business Development,Aliquam non mauris.
enhance visionary systems,Human Resources,Sed vel enim sit amet nunc viverra dapibus. Nulla suscipit ligula in lacus.
iterate ubiquitous relationships,Accounting,"Donec diam neque, vestibulum eget, vulputate ut, ultrices vel, augue. Vestibulum ante ipsum primis in faucibus orci luctus et ultrices posuere cubilia Curae; Donec pharetra, magna vestibulum aliquet ultrices, erat tortor sollicitudin mi, sit amet lobortis sapien sapien non mi."
exploit best-of-breed relationships,Legal,Morbi non lectus. Aliquam sit amet diam in magna bibendum imperdiet.
reinvent cross-media solutions,Research and Development,"Vestibulum ante ipsum primis in faucibus orci luctus et ultrices posuere cubilia Curae; Nulla dapibus dolor vel est. Donec odio justo, sollicitudin ut, suscipit a, feugiat et, eros."
syndicate B2C metrics,Research and Development,Curabitur gravida nisi at nibh. In hac habitasse platea dictumst.
cultivate mission-critical e-tailers,Services,Suspendisse ornare consequat lectus.
transform sexy interfaces,Training,Duis ac nibh.
implement plug-and-play synergies,Legal,Fusce consequat. Nulla nisl.
mesh vertical niches,Sales,Morbi non quam nec dui luctus rutrum.
reintermediate open-source niches,Business Development,Integer ac neque. Duis bibendum.
extend virtual paradigms,Human Resources,Duis ac nibh.
whiteboard robust action-items,Engineering,Etiam vel augue.
leverage open-source ROI,Business Development,"Mauris enim leo, rhoncus sed, vestibulum sit amet, cursus id, turpis. Integer aliquet, massa id lobortis convallis, tortor risus dapibus augue, vel accumsan tellus nisi eu orci."
architect magnetic e-markets,Business Development,"Cras in purus eu magna vulputate luctus. Cum sociis natoque penatibus et magnis dis parturient montes, nascetur ridiculus mus."
synthesize 24/7 experiences,Research and Development,"Lorem ipsum dolor sit amet, consectetuer adipiscing elit."
unleash user-centric e-markets,Sales,"Mauris enim leo, rhoncus sed, vestibulum sit amet, cursus id, turpis. Integer aliquet, massa id lobortis convallis, tortor risus dapibus augue, vel accumsan tellus nisi eu orci."
empower holistic architectures,Engineering,Nullam molestie nibh in lectus. Pellentesque at nulla.
syndicate synergistic communities,Sales,Proin interdum mauris non ligula pellentesque ultrices.
implement viral e-commerce,Research and Development,Praesent blandit.
unleash killer e-business,Marketing,Phasellus in felis. Donec semper sapien a libero.
implement dynamic deliverables,Training,"Duis bibendum, felis sed interdum venenatis, turpis enim blandit mi, in porttitor pede justo eu massa."
integrate efficient models,Sales,"Nulla neque libero, convallis eget, eleifend luctus, ultricies eu, nibh."
mesh granular action-items,Human Resources,"Cras mi pede, malesuada in, imperdiet et, commodo vulputate, justo. In blandit ultrices enim."
synergize integrated content,Training,"Maecenas tristique, est et tempus semper, est quam pharetra magna, ac consequat metus sapien ut nunc."
empower intuitive experiences,Legal,Vivamus in felis eu sapien cursus vestibulum.
integrate best-of-breed partnerships,Product Management,"Nullam orci pede, venenatis non, sodales sed, tincidunt eu, felis."
integrate sticky functionalities,Business Development,Aliquam erat volutpat.
benchmark revolutionary systems,Sales,"Donec vitae nisi. Nam ultrices, libero non mattis pulvinar, nulla pede ullamcorper augue, a suscipit nulla elit ac nulla."
whiteboard frictionless mindshare,Marketing,Maecenas rhoncus aliquam lacus. Morbi quis tortor id nulla ultrices aliquet.
e-enable B2B niches,Business Development,Suspendisse potenti.
target world-class solutions,Accounting,In quis justo.
deliver 24/365 methodologies,Engineering,In congue.
redefine dot-com models,Sales,"Cras mi pede, malesuada in, imperdiet et, commodo vulputate, justo."
embrace efficient infrastructures,Accounting,"Quisque arcu libero, rutrum ac, lobortis vel, dapibus at, diam."
expedite cutting-edge partnerships,Human Resources,"In hac habitasse platea dictumst. Morbi vestibulum, velit id pretium iaculis, diam erat fermentum justo, nec condimentum neque sapien placerat ante."
matrix seamless channels,Services,"Vestibulum quam sapien, varius ut, blandit non, interdum in, ante. Vestibulum ante ipsum primis in faucibus orci luctus et ultrices posuere cubilia Curae; Duis faucibus accumsan odio."
transition turn-key models,Research and Development,Duis mattis egestas metus. Aenean fermentum.
scale collaborative systems,Marketing,Etiam faucibus cursus urna.
innovate mission-critical architectures,Human Resources,Maecenas ut massa quis augue luctus tincidunt. Nulla mollis molestie lorem.
disintermediate frictionless portals,Human Resources,In quis justo.
evolve vertical models,Services,Phasellus sit amet erat. Nulla tempus.
synthesize plug-and-play solutions,Research and Development,Donec posuere metus vitae ipsum. Aliquam non mauris.
evolve one-to-one users,Business Development,"Quisque porta volutpat erat. Quisque erat eros, viverra eget, congue eget, semper rutrum, nulla."
transition granular ROI,Human Resources,Nullam sit amet turpis elementum ligula vehicula consequat. Morbi a ipsum.
expedite wireless eyeballs,Research and Development,"Morbi vestibulum, velit id pretium iaculis, diam erat fermentum justo, nec condimentum neque sapien placerat ante. Nulla justo."
enhance out-of-the-box content,Accounting,Nulla tellus. In sagittis dui vel nisl.
harness vertical infrastructures,Research and Development,Maecenas pulvinar lobortis est.
envisioneer 24/7 mindshare,Accounting,Integer ac leo.
aggregate back-end partnerships,Accounting,"Vestibulum ante ipsum primis in faucibus orci luctus et ultrices posuere cubilia Curae; Nulla dapibus dolor vel est. Donec odio justo, sollicitudin ut, suscipit a, feugiat et, eros."
drive value-added methodologies,Services,"Aliquam augue quam, sollicitudin vitae, consectetuer eget, rutrum at, lorem."
incentivize cutting-edge web-readiness,Product Management,Suspendisse potenti.
reintermediate best-of-breed systems,Marketing,Sed accumsan felis. Ut at dolor quis odio consequat varius.
exploit one-to-one deliverables,Engineering,Integer ac leo. Pellentesque ultrices mattis odio.
envisioneer interactive systems,Engineering,Donec quis orci eget orci vehicula condimentum. Curabitur in libero ut massa volutpat convallis.
harness dot-com portals,Engineering,Mauris lacinia sapien quis libero.
syndicate global e-business,Marketing,Suspendisse potenti.
iterate global initiatives,Accounting,Donec ut mauris eget massa tempor convallis.
empower cross-media interfaces,Research and Development,Nulla suscipit ligula in lacus. Curabitur at ipsum ac tellus semper interdum.
exploit front-end portals,Research and Development,Duis aliquam convallis nunc.
architect revolutionary solutions,Engineering,Mauris sit amet eros.
recontextualize e-business platforms,Sales,In sagittis dui vel nisl.
incubate collaborative e-commerce,Business Development,Vestibulum ante ipsum primis in faucibus orci luctus et ultrices posuere cubilia Curae; Duis faucibus accumsan odio. Curabitur convallis.
architect plug-and-play users,Accounting,In sagittis dui vel nisl. Duis ac nibh.
cultivate value-added schemas,Marketing,Phasellus sit amet erat.
transform sexy deliverables,Support,Maecenas pulvinar lobortis est.
visualize front-end niches,Legal,Vestibulum ante ipsum primis in faucibus orci luctus et ultrices posuere cubilia Curae; Duis faucibus accumsan odio. Curabitur convallis.
orchestrate efficient supply-chains,Support,Praesent blandit lacinia erat.
reintermediate integrated portals,Training,Nunc rhoncus dui vel sem. Sed sagittis.
syndicate B2B ROI,Product Management,Vivamus vel nulla eget eros elementum pellentesque. Quisque porta volutpat erat.
syndicate virtual e-business,Training,Pellentesque eget nunc. Donec quis orci eget orci vehicula condimentum.
deploy 24/365 schemas,Engineering,In eleifend quam a odio.
transform sticky interfaces,Marketing,In hac habitasse platea dictumst.
empower distributed e-business,Human Resources,Etiam vel augue. Vestibulum rutrum rutrum neque.
brand virtual e-services,Sales,Nunc rhoncus dui vel sem.
brand leading-edge web services,Support,Sed vel enim sit amet nunc viverra dapibus. Nulla suscipit ligula in lacus.
syndicate user-centric infomediaries,Support,Phasellus sit amet erat. Nulla tempus.
reinvent revolutionary channels,Legal,Donec semper sapien a libero.
productize 24/365 action-items,Training,"Donec vitae nisi. Nam ultrices, libero non mattis pulvinar, nulla pede ullamcorper augue, a suscipit nulla elit ac nulla."
scale impactful networks,Sales,"Cum sociis natoque penatibus et magnis dis parturient montes, nascetur ridiculus mus. Etiam vel augue."
maximize killer content,Marketing,Fusce posuere felis sed lacus.
productize proactive architectures,Services,Aliquam erat volutpat.
cultivate holistic niches,Accounting,Vivamus tortor. Duis mattis egestas metus.
disintermediate open-source synergies,Marketing,Vestibulum ac est lacinia nisi venenatis tristique.
target front-end vortals,Engineering,Duis ac nibh.
incubate e-business technologies,Legal,"Maecenas leo odio, condimentum id, luctus nec, molestie sed, justo. Pellentesque viverra pede ac diam."
enhance B2C mindshare,Accounting,"Morbi sem mauris, laoreet ut, rhoncus aliquet, pulvinar sed, nisl. Nunc rhoncus dui vel sem."
enhance customized synergies,Services,"Cras pellentesque volutpat dui. Maecenas tristique, est et tempus semper, est quam pharetra magna, ac consequat metus sapien ut nunc."
transition robust partnerships,Engineering,"Aliquam augue quam, sollicitudin vitae, consectetuer eget, rutrum at, lorem."
mesh web-enabled users,Accounting,Integer tincidunt ante vel ipsum. Praesent blandit lacinia erat.
brand strategic web services,Support,"Vestibulum ac est lacinia nisi venenatis tristique. Fusce congue, diam id ornare imperdiet, sapien urna pretium nisl, ut volutpat sapien arcu sed augue."
empower mission-critical relationships,Product Management,Integer ac neque.
architect mission-critical vortals,Accounting,"Nam dui. Proin leo odio, porttitor id, consequat in, consequat ut, nulla."
engineer revolutionary vortals,Human Resources,Nulla ut erat id mauris vulputate elementum.
mesh killer supply-chains,Sales,Duis aliquam convallis nunc. Proin at turpis a pede posuere nonummy.
extend turn-key web-readiness,Business Development,Nullam molestie nibh in lectus.
recontextualize customized infomediaries,Research and Development,"Maecenas tristique, est et tempus semper, est quam pharetra magna, ac consequat metus sapien ut nunc."
transition B2C supply-chains,Product Management,Vestibulum rutrum rutrum neque. Aenean auctor gravida sem.
revolutionize customized initiatives,Engineering,Suspendisse ornare consequat lectus.
matrix ubiquitous e-markets,Marketing,In hac habitasse platea dictumst. Maecenas ut massa quis augue luctus tincidunt.
implement frictionless synergies,Legal,"Maecenas tristique, est et tempus semper, est quam pharetra magna, ac consequat metus sapien ut nunc."
benchmark compelling web services,Marketing,"Phasellus id sapien in sapien iaculis congue. Vivamus metus arcu, adipiscing molestie, hendrerit at, vulputate vitae, nisl."
seize collaborative mindshare,Product Management,Integer tincidunt ante vel ipsum. Praesent blandit lacinia erat.
envisioneer dynamic infomediaries,Human Resources,"Nam ultrices, libero non mattis pulvinar, nulla pede ullamcorper augue, a suscipit nulla elit ac nulla."
integrate scalable functionalities,Marketing,Curabitur in libero ut massa volutpat convallis.
monetize clicks-and-mortar applications,Training,"Praesent lectus. Vestibulum quam sapien, varius ut, blandit non, interdum in, ante."
iterate 24/365 ROI,Accounting,Aenean sit amet justo. Morbi ut odio.
disintermediate cross-media eyeballs,Services,In hac habitasse platea dictumst.
iterate wireless niches,Services,Nulla tellus. In sagittis dui vel nisl.
redefine open-source eyeballs,Legal,"Cras mi pede, malesuada in, imperdiet et, commodo vulputate, justo."
maximize customized markets,Product Management,Aenean auctor gravida sem. Praesent id massa id nisl venenatis lacinia.
embrace transparent markets,Human Resources,Etiam faucibus cursus urna. Ut tellus.
harness viral vortals,Research and Development,In congue.
envisioneer visionary mindshare,Services,Nullam varius.
synergize B2B web-readiness,Engineering,In sagittis dui vel nisl. Duis ac nibh.
facilitate dynamic schemas,Training,"In est risus, auctor sed, tristique in, tempus sit amet, sem. Fusce consequat."
aggregate front-end e-services,Accounting,Aliquam erat volutpat. In congue.
streamline rich platforms,Research and Development,"Duis ac nibh. Fusce lacus purus, aliquet at, feugiat non, pretium quis, lectus."
incubate magnetic deliverables,Product Management,Maecenas pulvinar lobortis est. Phasellus sit amet erat.
iterate cutting-edge mindshare,Sales,Nulla nisl.
monetize dot-com niches,Engineering,Maecenas ut massa quis augue luctus tincidunt. Nulla mollis molestie lorem.
reinvent web-enabled infomediaries,Legal,Duis mattis egestas metus.
streamline ubiquitous mindshare,Legal,Phasellus sit amet erat. Nulla tempus.
scale rich markets,Human Resources,"In hac habitasse platea dictumst. Morbi vestibulum, velit id pretium iaculis, diam erat fermentum justo, nec condimentum neque sapien placerat ante."
engineer wireless action-items,Business Development,"Donec diam neque, vestibulum eget, vulputate ut, ultrices vel, augue. Vestibulum ante ipsum primis in faucibus orci luctus et ultrices posuere cubilia Curae; Donec pharetra, magna vestibulum aliquet ultrices, erat tortor sollicitudin mi, sit amet lobortis sapien sapien non mi."
empower intuitive users,Legal,Aenean lectus.
incubate B2B e-commerce,Training,"Maecenas tristique, est et tempus semper, est quam pharetra magna, ac consequat metus sapien ut nunc. Vestibulum ante ipsum primis in faucibus orci luctus et ultrices posuere cubilia Curae; Mauris viverra diam vitae quam."
facilitate enterprise initiatives,Engineering,Donec semper sapien a libero.
expedite vertical channels,Support,"Vivamus metus arcu, adipiscing molestie, hendrerit at, vulputate vitae, nisl. Aenean lectus."
scale proactive experiences,Services,"Morbi ut odio. Cras mi pede, malesuada in, imperdiet et, commodo vulputate, justo."
whiteboard bleeding-edge web services,Marketing,"Mauris enim leo, rhoncus sed, vestibulum sit amet, cursus id, turpis. Integer aliquet, massa id lobortis convallis, tortor risus dapibus augue, vel accumsan tellus nisi eu orci."
strategize global supply-chains,Business Development,"Morbi vel lectus in quam fringilla rhoncus. Mauris enim leo, rhoncus sed, vestibulum sit amet, cursus id, turpis."
productize turn-key experiences,Business Development,Aenean fermentum.
utilize killer synergies,Legal,Pellentesque ultrices mattis odio.
streamline B2B synergies,Services,"Integer non velit. Donec diam neque, vestibulum eget, vulputate ut, ultrices vel, augue."
architect next-generation mindshare,Legal,Aenean sit amet justo.
synthesize dot-com infomediaries,Services,Donec vitae nisi.
disintermediate real-time vortals,Research and Development,Nulla justo. Aliquam quis turpis eget elit sodales scelerisque.
implement innovative portals,Marketing,"Quisque erat eros, viverra eget, congue eget, semper rutrum, nulla."
embrace bleeding-edge e-commerce,Services,Integer ac neque. Duis bibendum.
whiteboard rich applications,Legal,"Vivamus metus arcu, adipiscing molestie, hendrerit at, vulputate vitae, nisl."
target front-end applications,Human Resources,"Mauris enim leo, rhoncus sed, vestibulum sit amet, cursus id, turpis."
iterate mission-critical relationships,Sales,Nulla facilisi.
harness bleeding-edge bandwidth,Product Management,Donec quis orci eget orci vehicula condimentum.
disintermediate sexy e-markets,Sales,"Nullam orci pede, venenatis non, sodales sed, tincidunt eu, felis."
recontextualize e-business niches,Services,"Duis bibendum, felis sed interdum venenatis, turpis enim blandit mi, in porttitor pede justo eu massa."
scale wireless platforms,Accounting,"Curabitur in libero ut massa volutpat convallis. Morbi odio odio, elementum eu, interdum eu, tincidunt in, leo."
transition plug-and-play bandwidth,Sales,Duis consequat dui nec nisi volutpat eleifend. Donec ut dolor.
harness bleeding-edge paradigms,Marketing,Nulla tempus.
synthesize rich supply-chains,Training,Cras non velit nec nisi vulputate nonummy. Maecenas tincidunt lacus at velit.
mesh proactive content,Marketing,Duis bibendum. Morbi non quam nec dui luctus rutrum.
innovate clicks-and-mortar supply-chains,Human Resources,In hac habitasse platea dictumst.
visualize dot-com networks,Research and Development,Donec ut dolor. Morbi vel lectus in quam fringilla rhoncus.
facilitate value-added systems,Training,Donec dapibus.
iterate collaborative action-items,Support,"Quisque erat eros, viverra eget, congue eget, semper rutrum, nulla. Nunc purus."
harness global eyeballs,Support,Suspendisse potenti. Cras in purus eu magna vulputate luctus.
