NameLesson,NameCourse,Description
reinvent collaborative applications,Services,"Cras in purus eu magna vulputate luctus. Cum sociis natoque penatibus et magnis dis parturient montes, nascetur ridiculus mus."
generate world-class partnerships,Sales,"Duis bibendum, felis sed interdum venenatis, turpis enim blandit mi, in porttitor pede justo eu massa."
morph value-added web services,Accounting,Proin eu mi. Nulla ac enim.
empower value-added convergence,Legal,"Vestibulum ante ipsum primis in faucibus orci luctus et ultrices posuere cubilia Curae; Donec pharetra, magna vestibulum aliquet ultrices, erat tortor sollicitudin mi, sit amet lobortis sapien sapien non mi."
embrace killer e-markets,Services,Sed sagittis.
maximize vertical content,Accounting,Cras in purus eu magna vulputate luctus.
leverage collaborative partnerships,Accounting,Praesent lectus.
benchmark e-business infrastructures,Product Management,"Integer pede justo, lacinia eget, tincidunt eget, tempus vel, pede. Morbi porttitor lorem id ligula."
reinvent revolutionary technologies,Engineering,Vivamus tortor. Duis mattis egestas metus.
brand rich vortals,Human Resources,"Morbi ut odio. Cras mi pede, malesuada in, imperdiet et, commodo vulputate, justo."
recontextualize revolutionary synergies,Accounting,Duis at velit eu est congue elementum. In hac habitasse platea dictumst.
streamline killer e-business,Marketing,In congue. Etiam justo.
leverage rich convergence,Accounting,Mauris lacinia sapien quis libero.
productize collaborative markets,Legal,Vestibulum rutrum rutrum neque. Aenean auctor gravida sem.
reinvent impactful deliverables,Product Management,"Vestibulum quam sapien, varius ut, blandit non, interdum in, ante. Vestibulum ante ipsum primis in faucibus orci luctus et ultrices posuere cubilia Curae; Duis faucibus accumsan odio."
mesh mission-critical architectures,Marketing,Suspendisse ornare consequat lectus.
expedite distributed convergence,Product Management,Etiam faucibus cursus urna.
engage cross-platform content,Support,Fusce posuere felis sed lacus.
drive customized content,Research and Development,Morbi non quam nec dui luctus rutrum. Nulla tellus.
streamline B2C partnerships,Services,"Praesent lectus. Vestibulum quam sapien, varius ut, blandit non, interdum in, ante."
exploit open-source deliverables,Services,Duis mattis egestas metus.
monetize rich e-tailers,Legal,"Integer aliquet, massa id lobortis convallis, tortor risus dapibus augue, vel accumsan tellus nisi eu orci."
aggregate wireless portals,Human Resources,Ut tellus.
mesh world-class experiences,Engineering,"Vestibulum ante ipsum primis in faucibus orci luctus et ultrices posuere cubilia Curae; Donec pharetra, magna vestibulum aliquet ultrices, erat tortor sollicitudin mi, sit amet lobortis sapien sapien non mi. Integer ac neque."
target e-business convergence,Training,Morbi porttitor lorem id ligula. Suspendisse ornare consequat lectus.
implement revolutionary networks,Marketing,"Duis bibendum, felis sed interdum venenatis, turpis enim blandit mi, in porttitor pede justo eu massa. Donec dapibus."
transform dot-com web services,Support,Morbi non lectus. Aliquam sit amet diam in magna bibendum imperdiet.
utilize viral methodologies,Human Resources,"Cum sociis natoque penatibus et magnis dis parturient montes, nascetur ridiculus mus."
grow user-centric e-commerce,Services,"Nunc nisl. Duis bibendum, felis sed interdum venenatis, turpis enim blandit mi, in porttitor pede justo eu massa."
deploy user-centric initiatives,Legal,Fusce consequat.
aggregate seamless content,Marketing,Vestibulum rutrum rutrum neque.
morph plug-and-play users,Human Resources,"Morbi sem mauris, laoreet ut, rhoncus aliquet, pulvinar sed, nisl. Nunc rhoncus dui vel sem."
mesh end-to-end portals,Support,Aliquam erat volutpat.
redefine bleeding-edge functionalities,Services,"Praesent lectus. Vestibulum quam sapien, varius ut, blandit non, interdum in, ante."
integrate one-to-one communities,Research and Development,"Cras mi pede, malesuada in, imperdiet et, commodo vulputate, justo."
morph B2C eyeballs,Human Resources,Ut tellus. Nulla ut erat id mauris vulputate elementum.
deploy integrated web services,Legal,"Nullam orci pede, venenatis non, sodales sed, tincidunt eu, felis. Fusce posuere felis sed lacus."
target viral web services,Support,"Nam congue, risus semper porta volutpat, quam pede lobortis ligula, sit amet eleifend pede libero quis orci."
streamline one-to-one technologies,Training,"Fusce congue, diam id ornare imperdiet, sapien urna pretium nisl, ut volutpat sapien arcu sed augue. Aliquam erat volutpat."
scale distributed ROI,Engineering,Morbi porttitor lorem id ligula.
envisioneer real-time convergence,Training,Duis bibendum. Morbi non quam nec dui luctus rutrum.
benchmark B2C convergence,Engineering,"Maecenas leo odio, condimentum id, luctus nec, molestie sed, justo. Pellentesque viverra pede ac diam."
utilize scalable e-business,Marketing,"Integer pede justo, lacinia eget, tincidunt eget, tempus vel, pede."
deploy front-end e-tailers,Business Development,Nullam varius. Nulla facilisi.
incubate end-to-end interfaces,Support,Morbi non quam nec dui luctus rutrum. Nulla tellus.
exploit killer platforms,Marketing,Mauris sit amet eros. Suspendisse accumsan tortor quis turpis.
brand granular architectures,Product Management,"Nullam orci pede, venenatis non, sodales sed, tincidunt eu, felis. Fusce posuere felis sed lacus."
drive cross-platform interfaces,Research and Development,Donec dapibus.
deploy best-of-breed interfaces,Engineering,Suspendisse potenti.
iterate seamless niches,Engineering,Nulla facilisi. Cras non velit nec nisi vulputate nonummy.
reintermediate e-business e-business,Training,Nam nulla.
redefine collaborative infrastructures,Support,Nulla ut erat id mauris vulputate elementum. Nullam varius.
incubate magnetic platforms,Marketing,Nullam molestie nibh in lectus.
aggregate proactive applications,Services,Aenean sit amet justo.
integrate robust relationships,Training,Phasellus id sapien in sapien iaculis congue.
orchestrate integrated bandwidth,Accounting,Sed ante. Vivamus tortor.
strategize strategic metrics,Engineering,Duis consequat dui nec nisi volutpat eleifend. Donec ut dolor.
iterate front-end networks,Services,"Integer aliquet, massa id lobortis convallis, tortor risus dapibus augue, vel accumsan tellus nisi eu orci. Mauris lacinia sapien quis libero."
drive cross-media content,Research and Development,Maecenas rhoncus aliquam lacus. Morbi quis tortor id nulla ultrices aliquet.
exploit out-of-the-box bandwidth,Support,Aliquam sit amet diam in magna bibendum imperdiet.
strategize end-to-end bandwidth,Services,Mauris lacinia sapien quis libero.
enhance ubiquitous content,Research and Development,Vivamus tortor. Duis mattis egestas metus.
grow cross-media infrastructures,Support,Suspendisse potenti.
harness dynamic synergies,Sales,Mauris sit amet eros.
evolve ubiquitous functionalities,Accounting,"Lorem ipsum dolor sit amet, consectetuer adipiscing elit."
incentivize transparent models,Business Development,"Quisque arcu libero, rutrum ac, lobortis vel, dapibus at, diam. Nam tristique tortor eu pede."
drive end-to-end infrastructures,Human Resources,"Fusce congue, diam id ornare imperdiet, sapien urna pretium nisl, ut volutpat sapien arcu sed augue. Aliquam erat volutpat."
target cross-platform users,Training,Nulla tellus. In sagittis dui vel nisl.
engage 24/7 platforms,Research and Development,"Donec diam neque, vestibulum eget, vulputate ut, ultrices vel, augue."
engage transparent vortals,Research and Development,"Donec vitae nisi. Nam ultrices, libero non mattis pulvinar, nulla pede ullamcorper augue, a suscipit nulla elit ac nulla."
aggregate interactive channels,Engineering,Proin interdum mauris non ligula pellentesque ultrices.
utilize B2B e-tailers,Research and Development,Nulla tempus. Vivamus in felis eu sapien cursus vestibulum.
iterate virtual architectures,Training,Phasellus in felis. Donec semper sapien a libero.
reintermediate user-centric platforms,Training,"Fusce congue, diam id ornare imperdiet, sapien urna pretium nisl, ut volutpat sapien arcu sed augue. Aliquam erat volutpat."
facilitate wireless networks,Business Development,Proin eu mi. Nulla ac enim.
visualize transparent action-items,Accounting,Vivamus in felis eu sapien cursus vestibulum.
embrace killer communities,Training,Nulla justo. Aliquam quis turpis eget elit sodales scelerisque.
e-enable compelling web services,Training,"Vestibulum quam sapien, varius ut, blandit non, interdum in, ante."
grow extensible partnerships,Accounting,"Donec ut mauris eget massa tempor convallis. Nulla neque libero, convallis eget, eleifend luctus, ultricies eu, nibh."
matrix leading-edge channels,Business Development,Aenean fermentum.
expedite cutting-edge users,Human Resources,"Morbi vel lectus in quam fringilla rhoncus. Mauris enim leo, rhoncus sed, vestibulum sit amet, cursus id, turpis."
benchmark plug-and-play technologies,Human Resources,"Nullam orci pede, venenatis non, sodales sed, tincidunt eu, felis."
target out-of-the-box channels,Legal,Duis ac nibh.
incubate mission-critical e-business,Support,Pellentesque at nulla.
enhance frictionless action-items,Product Management,Maecenas pulvinar lobortis est.
integrate integrated relationships,Sales,"Duis ac nibh. Fusce lacus purus, aliquet at, feugiat non, pretium quis, lectus."
reinvent collaborative methodologies,Business Development,Praesent id massa id nisl venenatis lacinia.
whiteboard visionary partnerships,Services,Nulla ut erat id mauris vulputate elementum.
morph integrated methodologies,Business Development,Nulla mollis molestie lorem. Quisque ut erat.
morph bleeding-edge ROI,Legal,Pellentesque eget nunc. Donec quis orci eget orci vehicula condimentum.
transition B2B users,Research and Development,"Aliquam sit amet diam in magna bibendum imperdiet. Nullam orci pede, venenatis non, sodales sed, tincidunt eu, felis."
matrix transparent technologies,Research and Development,Donec quis orci eget orci vehicula condimentum. Curabitur in libero ut massa volutpat convallis.
reinvent user-centric solutions,Sales,"Nulla neque libero, convallis eget, eleifend luctus, ultricies eu, nibh. Quisque id justo sit amet sapien dignissim vestibulum."
orchestrate impactful communities,Research and Development,In hac habitasse platea dictumst.
incubate turn-key networks,Engineering,"Donec diam neque, vestibulum eget, vulputate ut, ultrices vel, augue. Vestibulum ante ipsum primis in faucibus orci luctus et ultrices posuere cubilia Curae; Donec pharetra, magna vestibulum aliquet ultrices, erat tortor sollicitudin mi, sit amet lobortis sapien sapien non mi."
envisioneer magnetic infrastructures,Sales,Mauris sit amet eros.
empower visionary vortals,Legal,Nulla tellus. In sagittis dui vel nisl.
synergize bleeding-edge infomediaries,Legal,Vivamus vestibulum sagittis sapien.
drive distributed functionalities,Product Management,Nullam varius. Nulla facilisi.
extend sticky portals,Services,Duis mattis egestas metus. Aenean fermentum.
deploy vertical mindshare,Sales,"Cras mi pede, malesuada in, imperdiet et, commodo vulputate, justo. In blandit ultrices enim."
strategize back-end partnerships,Marketing,Suspendisse ornare consequat lectus.
morph cross-media deliverables,Business Development,Morbi ut odio.
transition B2B technologies,Training,Duis bibendum.
enhance value-added e-commerce,Training,Nunc rhoncus dui vel sem. Sed sagittis.
redefine global infrastructures,Services,Sed sagittis.
mesh real-time partnerships,Legal,Donec semper sapien a libero. Nam dui.
seize synergistic metrics,Research and Development,Aenean lectus.
deliver extensible solutions,Support,Sed vel enim sit amet nunc viverra dapibus.
extend intuitive platforms,Support,"Cum sociis natoque penatibus et magnis dis parturient montes, nascetur ridiculus mus."
integrate one-to-one deliverables,Accounting,Sed vel enim sit amet nunc viverra dapibus.
engage holistic e-services,Business Development,Etiam justo.
innovate magnetic supply-chains,Accounting,Curabitur at ipsum ac tellus semper interdum. Mauris ullamcorper purus sit amet nulla.
morph efficient niches,Marketing,Nulla tempus. Vivamus in felis eu sapien cursus vestibulum.
deliver sexy functionalities,Business Development,Integer a nibh. In quis justo.
visualize bricks-and-clicks schemas,Business Development,Nam nulla.
matrix magnetic markets,Marketing,Curabitur gravida nisi at nibh. In hac habitasse platea dictumst.
orchestrate impactful portals,Training,Nullam sit amet turpis elementum ligula vehicula consequat.
cultivate killer channels,Legal,Nullam sit amet turpis elementum ligula vehicula consequat.
scale robust e-services,Human Resources,"Proin leo odio, porttitor id, consequat in, consequat ut, nulla. Sed accumsan felis."
synergize seamless schemas,Research and Development,"In est risus, auctor sed, tristique in, tempus sit amet, sem. Fusce consequat."
seize B2B solutions,Accounting,Suspendisse potenti. In eleifend quam a odio.
expedite world-class paradigms,Legal,Vivamus vel nulla eget eros elementum pellentesque. Quisque porta volutpat erat.
monetize plug-and-play initiatives,Support,Quisque ut erat.
exploit clicks-and-mortar ROI,Legal,In hac habitasse platea dictumst.
recontextualize out-of-the-box initiatives,Engineering,"Nullam orci pede, venenatis non, sodales sed, tincidunt eu, felis."
brand user-centric convergence,Research and Development,Cras in purus eu magna vulputate luctus.
drive dot-com e-markets,Product Management,"Integer non velit. Donec diam neque, vestibulum eget, vulputate ut, ultrices vel, augue."
morph 24/7 e-tailers,Research and Development,Proin risus.
optimize real-time ROI,Training,Vestibulum ante ipsum primis in faucibus orci luctus et ultrices posuere cubilia Curae; Nulla dapibus dolor vel est.
exploit out-of-the-box networks,Sales,"In est risus, auctor sed, tristique in, tempus sit amet, sem. Fusce consequat."
benchmark one-to-one networks,Marketing,Phasellus id sapien in sapien iaculis congue.
transform impactful functionalities,Product Management,Etiam vel augue. Vestibulum rutrum rutrum neque.
expedite collaborative portals,Sales,"Integer aliquet, massa id lobortis convallis, tortor risus dapibus augue, vel accumsan tellus nisi eu orci. Mauris lacinia sapien quis libero."
synthesize revolutionary web services,Training,In hac habitasse platea dictumst.
synergize viral users,Research and Development,Donec quis orci eget orci vehicula condimentum.
deploy real-time interfaces,Business Development,Morbi ut odio.
extend sticky technologies,Legal,"Donec diam neque, vestibulum eget, vulputate ut, ultrices vel, augue. Vestibulum ante ipsum primis in faucibus orci luctus et ultrices posuere cubilia Curae; Donec pharetra, magna vestibulum aliquet ultrices, erat tortor sollicitudin mi, sit amet lobortis sapien sapien non mi."
monetize proactive web services,Services,Maecenas pulvinar lobortis est. Phasellus sit amet erat.
architect dynamic infomediaries,Business Development,"Morbi sem mauris, laoreet ut, rhoncus aliquet, pulvinar sed, nisl. Nunc rhoncus dui vel sem."
unleash global niches,Marketing,"In blandit ultrices enim. Lorem ipsum dolor sit amet, consectetuer adipiscing elit."
visualize e-business initiatives,Support,"Cum sociis natoque penatibus et magnis dis parturient montes, nascetur ridiculus mus."
brand killer relationships,Marketing,Maecenas rhoncus aliquam lacus. Morbi quis tortor id nulla ultrices aliquet.
cultivate sexy relationships,Legal,Fusce consequat.
embrace visionary niches,Accounting,Duis consequat dui nec nisi volutpat eleifend.
brand end-to-end synergies,Sales,Vestibulum sed magna at nunc commodo placerat. Praesent blandit.
monetize rich mindshare,Accounting,Etiam justo. Etiam pretium iaculis justo.
synthesize value-added action-items,Marketing,"Duis bibendum, felis sed interdum venenatis, turpis enim blandit mi, in porttitor pede justo eu massa. Donec dapibus."
deliver ubiquitous e-commerce,Product Management,In hac habitasse platea dictumst. Etiam faucibus cursus urna.
cultivate front-end e-commerce,Business Development,Donec ut mauris eget massa tempor convallis.
strategize integrated e-markets,Human Resources,"In blandit ultrices enim. Lorem ipsum dolor sit amet, consectetuer adipiscing elit."
morph dot-com interfaces,Support,Maecenas pulvinar lobortis est.
e-enable scalable vortals,Product Management,Aenean lectus.
productize enterprise niches,Support,Nam nulla.
streamline dot-com applications,Product Management,Aliquam quis turpis eget elit sodales scelerisque. Mauris sit amet eros.
deliver impactful convergence,Product Management,"Cum sociis natoque penatibus et magnis dis parturient montes, nascetur ridiculus mus."
exploit impactful architectures,Research and Development,"Integer aliquet, massa id lobortis convallis, tortor risus dapibus augue, vel accumsan tellus nisi eu orci. Mauris lacinia sapien quis libero."
generate open-source methodologies,Marketing,"Vestibulum ante ipsum primis in faucibus orci luctus et ultrices posuere cubilia Curae; Nulla dapibus dolor vel est. Donec odio justo, sollicitudin ut, suscipit a, feugiat et, eros."
integrate cross-media content,Sales,Etiam pretium iaculis justo.
integrate out-of-the-box e-tailers,Research and Development,"Cum sociis natoque penatibus et magnis dis parturient montes, nascetur ridiculus mus."
morph cross-media e-commerce,Services,"Duis ac nibh. Fusce lacus purus, aliquet at, feugiat non, pretium quis, lectus."
recontextualize user-centric synergies,Sales,Nam nulla.
morph e-business web-readiness,Human Resources,"Morbi quis tortor id nulla ultrices aliquet. Maecenas leo odio, condimentum id, luctus nec, molestie sed, justo."
iterate turn-key architectures,Legal,"Nam congue, risus semper porta volutpat, quam pede lobortis ligula, sit amet eleifend pede libero quis orci."
facilitate robust niches,Legal,"In hac habitasse platea dictumst. Aliquam augue quam, sollicitudin vitae, consectetuer eget, rutrum at, lorem."
engage 24/7 metrics,Research and Development,"Quisque erat eros, viverra eget, congue eget, semper rutrum, nulla. Nunc purus."
revolutionize killer content,Training,Praesent lectus.
recontextualize one-to-one e-markets,Services,"Integer non velit. Donec diam neque, vestibulum eget, vulputate ut, ultrices vel, augue."
innovate out-of-the-box web services,Product Management,"In tempor, turpis nec euismod scelerisque, quam turpis adipiscing lorem, vitae mattis nibh ligula nec sem."
implement visionary e-commerce,Engineering,Maecenas ut massa quis augue luctus tincidunt. Nulla mollis molestie lorem.
repurpose 24/365 partnerships,Research and Development,"Maecenas tristique, est et tempus semper, est quam pharetra magna, ac consequat metus sapien ut nunc."
scale global paradigms,Business Development,Aenean sit amet justo. Morbi ut odio.
harness killer platforms,Marketing,Integer ac leo. Pellentesque ultrices mattis odio.
engage clicks-and-mortar initiatives,Services,Quisque ut erat. Curabitur gravida nisi at nibh.
revolutionize virtual infrastructures,Human Resources,"Lorem ipsum dolor sit amet, consectetuer adipiscing elit. Proin risus."
cultivate collaborative users,Support,"Donec odio justo, sollicitudin ut, suscipit a, feugiat et, eros. Vestibulum ac est lacinia nisi venenatis tristique."
extend open-source infomediaries,Human Resources,Duis mattis egestas metus. Aenean fermentum.
generate sexy functionalities,Legal,Pellentesque at nulla.
monetize e-business e-business,Accounting,Nunc purus.
facilitate collaborative niches,Legal,"In est risus, auctor sed, tristique in, tempus sit amet, sem."
morph dynamic web services,Training,In hac habitasse platea dictumst. Etiam faucibus cursus urna.
unleash intuitive solutions,Product Management,Nulla nisl.
incentivize robust architectures,Accounting,"Nunc nisl. Duis bibendum, felis sed interdum venenatis, turpis enim blandit mi, in porttitor pede justo eu massa."
synergize user-centric infrastructures,Business Development,Mauris lacinia sapien quis libero. Nullam sit amet turpis elementum ligula vehicula consequat.
enable robust methodologies,Legal,"Morbi sem mauris, laoreet ut, rhoncus aliquet, pulvinar sed, nisl."
revolutionize killer platforms,Product Management,"Quisque erat eros, viverra eget, congue eget, semper rutrum, nulla. Nunc purus."
matrix end-to-end web services,Engineering,Etiam justo. Etiam pretium iaculis justo.
harness mission-critical paradigms,Support,"Nam nulla. Integer pede justo, lacinia eget, tincidunt eget, tempus vel, pede."
aggregate integrated paradigms,Research and Development,"Vestibulum quam sapien, varius ut, blandit non, interdum in, ante. Vestibulum ante ipsum primis in faucibus orci luctus et ultrices posuere cubilia Curae; Duis faucibus accumsan odio."
architect bricks-and-clicks portals,Accounting,"Quisque arcu libero, rutrum ac, lobortis vel, dapibus at, diam. Nam tristique tortor eu pede."
e-enable virtual content,Human Resources,Donec semper sapien a libero.
implement turn-key channels,Sales,"Cum sociis natoque penatibus et magnis dis parturient montes, nascetur ridiculus mus. Vivamus vestibulum sagittis sapien."
enable collaborative paradigms,Legal,Donec quis orci eget orci vehicula condimentum. Curabitur in libero ut massa volutpat convallis.
drive leading-edge portals,Legal,Ut tellus.
benchmark end-to-end initiatives,Research and Development,Duis aliquam convallis nunc. Proin at turpis a pede posuere nonummy.
streamline one-to-one convergence,Engineering,"Donec odio justo, sollicitudin ut, suscipit a, feugiat et, eros."
facilitate proactive action-items,Product Management,Praesent blandit.
morph extensible platforms,Accounting,"Integer aliquet, massa id lobortis convallis, tortor risus dapibus augue, vel accumsan tellus nisi eu orci."
maximize dot-com systems,Product Management,"In tempor, turpis nec euismod scelerisque, quam turpis adipiscing lorem, vitae mattis nibh ligula nec sem."
implement impactful solutions,Business Development,"Vestibulum quam sapien, varius ut, blandit non, interdum in, ante."
transition open-source users,Services,Quisque id justo sit amet sapien dignissim vestibulum. Vestibulum ante ipsum primis in faucibus orci luctus et ultrices posuere cubilia Curae; Nulla dapibus dolor vel est.
syndicate cross-platform e-markets,Marketing,Sed vel enim sit amet nunc viverra dapibus.
synergize end-to-end channels,Sales,Quisque ut erat. Curabitur gravida nisi at nibh.
transform sexy paradigms,Services,"In est risus, auctor sed, tristique in, tempus sit amet, sem."
aggregate world-class experiences,Human Resources,"Cum sociis natoque penatibus et magnis dis parturient montes, nascetur ridiculus mus. Etiam vel augue."
facilitate turn-key paradigms,Human Resources,"Vivamus vestibulum sagittis sapien. Cum sociis natoque penatibus et magnis dis parturient montes, nascetur ridiculus mus."
deliver web-enabled partnerships,Engineering,Proin eu mi.
harness real-time e-business,Research and Development,Phasellus in felis.
reinvent seamless schemas,Human Resources,Duis mattis egestas metus. Aenean fermentum.
synthesize one-to-one technologies,Human Resources,Pellentesque eget nunc.
transition back-end methodologies,Product Management,Nulla tempus.
strategize seamless users,Product Management,Donec semper sapien a libero.
expedite leading-edge ROI,Support,Vestibulum ante ipsum primis in faucibus orci luctus et ultrices posuere cubilia Curae; Duis faucibus accumsan odio.
whiteboard cross-media deliverables,Services,In quis justo. Maecenas rhoncus aliquam lacus.
disintermediate frictionless deliverables,Legal,"In hac habitasse platea dictumst. Morbi vestibulum, velit id pretium iaculis, diam erat fermentum justo, nec condimentum neque sapien placerat ante."
cultivate magnetic users,Business Development,Nam tristique tortor eu pede.
incubate frictionless e-business,Training,"Morbi sem mauris, laoreet ut, rhoncus aliquet, pulvinar sed, nisl."
empower next-generation supply-chains,Business Development,Maecenas tincidunt lacus at velit. Vivamus vel nulla eget eros elementum pellentesque.
transition world-class applications,Product Management,"In tempor, turpis nec euismod scelerisque, quam turpis adipiscing lorem, vitae mattis nibh ligula nec sem."
exploit holistic networks,Product Management,Integer a nibh. In quis justo.
iterate dynamic web-readiness,Research and Development,Sed accumsan felis. Ut at dolor quis odio consequat varius.
orchestrate ubiquitous portals,Marketing,Vestibulum ante ipsum primis in faucibus orci luctus et ultrices posuere cubilia Curae; Duis faucibus accumsan odio. Curabitur convallis.
iterate end-to-end technologies,Sales,Aliquam non mauris. Morbi non lectus.
synergize bleeding-edge markets,Research and Development,"Morbi vestibulum, velit id pretium iaculis, diam erat fermentum justo, nec condimentum neque sapien placerat ante. Nulla justo."
empower leading-edge supply-chains,Research and Development,Aenean fermentum.
redefine front-end ROI,Marketing,Nulla mollis molestie lorem. Quisque ut erat.
streamline cross-media vortals,Training,"Proin leo odio, porttitor id, consequat in, consequat ut, nulla. Sed accumsan felis."
benchmark 24/365 portals,Marketing,Nulla nisl. Nunc nisl.
synergize sexy markets,Legal,Proin at turpis a pede posuere nonummy.
envisioneer innovative communities,Product Management,"In tempor, turpis nec euismod scelerisque, quam turpis adipiscing lorem, vitae mattis nibh ligula nec sem. Duis aliquam convallis nunc."
implement frictionless bandwidth,Engineering,Vivamus tortor.
morph user-centric communities,Research and Development,Nullam sit amet turpis elementum ligula vehicula consequat.
transition cross-platform paradigms,Sales,Etiam pretium iaculis justo. In hac habitasse platea dictumst.
generate rich applications,Legal,Integer tincidunt ante vel ipsum. Praesent blandit lacinia erat.
transform 24/7 relationships,Services,Sed accumsan felis. Ut at dolor quis odio consequat varius.
