NameLesson,NameCourse,Description
integrate bricks-and-clicks functionalities,Human Resources,Mauris sit amet eros. Suspendisse accumsan tortor quis turpis.
seize collaborative relationships,Sales,Integer ac leo. Pellentesque ultrices mattis odio.
revolutionize web-enabled eyeballs,Engineering,Nullam molestie nibh in lectus.
iterate sexy e-commerce,Research and Development,"Vestibulum ac est lacinia nisi venenatis tristique. Fusce congue, diam id ornare imperdiet, sapien urna pretium nisl, ut volutpat sapien arcu sed augue."
target out-of-the-box bandwidth,Accounting,Pellentesque ultrices mattis odio.
transition strategic users,Services,Vestibulum ac est lacinia nisi venenatis tristique.
innovate cross-media channels,Sales,Nullam molestie nibh in lectus. Pellentesque at nulla.
repurpose dynamic web services,Engineering,Proin at turpis a pede posuere nonummy.
seize end-to-end synergies,Training,Suspendisse ornare consequat lectus.
transition sticky content,Business Development,"Mauris enim leo, rhoncus sed, vestibulum sit amet, cursus id, turpis. Integer aliquet, massa id lobortis convallis, tortor risus dapibus augue, vel accumsan tellus nisi eu orci."
leverage enterprise portals,Engineering,Proin at turpis a pede posuere nonummy.
iterate impactful convergence,Training,In hac habitasse platea dictumst.
benchmark strategic paradigms,Accounting,"In hac habitasse platea dictumst. Aliquam augue quam, sollicitudin vitae, consectetuer eget, rutrum at, lorem."
repurpose proactive portals,Support,"Lorem ipsum dolor sit amet, consectetuer adipiscing elit. Proin interdum mauris non ligula pellentesque ultrices."
engineer collaborative vortals,Marketing,"Morbi sem mauris, laoreet ut, rhoncus aliquet, pulvinar sed, nisl."
incentivize proactive networks,Research and Development,Proin at turpis a pede posuere nonummy. Integer non velit.
cultivate killer initiatives,Product Management,In eleifend quam a odio. In hac habitasse platea dictumst.
evolve leading-edge e-commerce,Legal,Morbi quis tortor id nulla ultrices aliquet.
integrate seamless e-markets,Legal,Curabitur at ipsum ac tellus semper interdum. Mauris ullamcorper purus sit amet nulla.
optimize seamless schemas,Services,Phasellus sit amet erat.
facilitate sexy systems,Marketing,Mauris ullamcorper purus sit amet nulla.
strategize customized systems,Engineering,Aenean lectus. Pellentesque eget nunc.
incubate sticky networks,Sales,Nam nulla.
iterate strategic e-business,Support,Proin interdum mauris non ligula pellentesque ultrices.
exploit customized models,Human Resources,Pellentesque viverra pede ac diam. Cras pellentesque volutpat dui.
expedite cutting-edge systems,Engineering,Curabitur at ipsum ac tellus semper interdum.
embrace strategic metrics,Sales,Pellentesque at nulla.
reinvent turn-key e-tailers,Accounting,In hac habitasse platea dictumst. Maecenas ut massa quis augue luctus tincidunt.
scale seamless networks,Accounting,Morbi ut odio.
redefine impactful mindshare,Training,Morbi non quam nec dui luctus rutrum. Nulla tellus.
benchmark open-source eyeballs,Engineering,Suspendisse potenti. Cras in purus eu magna vulputate luctus.
evolve granular relationships,Sales,Maecenas pulvinar lobortis est. Phasellus sit amet erat.
unleash bricks-and-clicks communities,Product Management,In hac habitasse platea dictumst. Etiam faucibus cursus urna.
scale cross-platform channels,Human Resources,"Fusce lacus purus, aliquet at, feugiat non, pretium quis, lectus."
disintermediate leading-edge systems,Training,Fusce consequat. Nulla nisl.
generate vertical metrics,Sales,Nullam varius.
optimize best-of-breed web-readiness,Business Development,"Quisque arcu libero, rutrum ac, lobortis vel, dapibus at, diam."
orchestrate virtual systems,Sales,"Vestibulum quam sapien, varius ut, blandit non, interdum in, ante. Vestibulum ante ipsum primis in faucibus orci luctus et ultrices posuere cubilia Curae; Duis faucibus accumsan odio."
envisioneer innovative interfaces,Legal,Vivamus vel nulla eget eros elementum pellentesque.
disintermediate next-generation deliverables,Business Development,Aenean auctor gravida sem. Praesent id massa id nisl venenatis lacinia.
implement collaborative portals,Sales,Vestibulum ante ipsum primis in faucibus orci luctus et ultrices posuere cubilia Curae; Mauris viverra diam vitae quam.
repurpose B2C niches,Business Development,"Proin leo odio, porttitor id, consequat in, consequat ut, nulla."
expedite out-of-the-box applications,Support,Nulla tellus.
incubate ubiquitous experiences,Support,"In hac habitasse platea dictumst. Aliquam augue quam, sollicitudin vitae, consectetuer eget, rutrum at, lorem."
grow best-of-breed relationships,Product Management,Proin at turpis a pede posuere nonummy.
exploit sexy technologies,Support,Nulla nisl. Nunc nisl.
facilitate frictionless mindshare,Training,Morbi non lectus.
engage distributed architectures,Sales,Mauris lacinia sapien quis libero. Nullam sit amet turpis elementum ligula vehicula consequat.
revolutionize proactive technologies,Marketing,Etiam pretium iaculis justo. In hac habitasse platea dictumst.
unleash dot-com web-readiness,Human Resources,Pellentesque viverra pede ac diam. Cras pellentesque volutpat dui.
revolutionize compelling channels,Accounting,"Fusce congue, diam id ornare imperdiet, sapien urna pretium nisl, ut volutpat sapien arcu sed augue."
morph cross-media initiatives,Training,Quisque ut erat. Curabitur gravida nisi at nibh.
reinvent synergistic e-services,Research and Development,Phasellus id sapien in sapien iaculis congue.
embrace turn-key e-business,Human Resources,"Duis bibendum, felis sed interdum venenatis, turpis enim blandit mi, in porttitor pede justo eu massa."
revolutionize value-added communities,Engineering,"Maecenas leo odio, condimentum id, luctus nec, molestie sed, justo. Pellentesque viverra pede ac diam."
maximize ubiquitous platforms,Product Management,"Nullam orci pede, venenatis non, sodales sed, tincidunt eu, felis."
whiteboard end-to-end methodologies,Marketing,Praesent lectus.
grow cross-media mindshare,Sales,"Morbi odio odio, elementum eu, interdum eu, tincidunt in, leo."
engineer interactive models,Engineering,"Fusce congue, diam id ornare imperdiet, sapien urna pretium nisl, ut volutpat sapien arcu sed augue."
harness out-of-the-box e-commerce,Support,Aenean sit amet justo. Morbi ut odio.
orchestrate B2C vortals,Legal,"Fusce congue, diam id ornare imperdiet, sapien urna pretium nisl, ut volutpat sapien arcu sed augue. Aliquam erat volutpat."
incentivize cross-platform communities,Engineering,Nulla suscipit ligula in lacus.
disintermediate turn-key paradigms,Training,"Duis ac nibh. Fusce lacus purus, aliquet at, feugiat non, pretium quis, lectus."
aggregate impactful paradigms,Human Resources,In congue. Etiam justo.
iterate granular relationships,Training,"Praesent lectus. Vestibulum quam sapien, varius ut, blandit non, interdum in, ante."
cultivate proactive interfaces,Research and Development,Aliquam quis turpis eget elit sodales scelerisque.
facilitate seamless paradigms,Product Management,Praesent id massa id nisl venenatis lacinia.
utilize one-to-one solutions,Accounting,Cras non velit nec nisi vulputate nonummy. Maecenas tincidunt lacus at velit.
recontextualize 24/365 applications,Business Development,"Nam ultrices, libero non mattis pulvinar, nulla pede ullamcorper augue, a suscipit nulla elit ac nulla."
unleash web-enabled systems,Accounting,"Cras in purus eu magna vulputate luctus. Cum sociis natoque penatibus et magnis dis parturient montes, nascetur ridiculus mus."
cultivate vertical methodologies,Product Management,"Vivamus metus arcu, adipiscing molestie, hendrerit at, vulputate vitae, nisl."
implement global portals,Training,Etiam vel augue. Vestibulum rutrum rutrum neque.
productize virtual bandwidth,Engineering,Nunc rhoncus dui vel sem. Sed sagittis.
syndicate bricks-and-clicks initiatives,Legal,Donec quis orci eget orci vehicula condimentum. Curabitur in libero ut massa volutpat convallis.
transform 24/365 architectures,Training,Vivamus vel nulla eget eros elementum pellentesque.
envisioneer web-enabled supply-chains,Marketing,Aliquam erat volutpat. In congue.
repurpose interactive models,Product Management,"Donec diam neque, vestibulum eget, vulputate ut, ultrices vel, augue."
enable efficient paradigms,Human Resources,Etiam justo.
extend holistic technologies,Services,Nulla nisl. Nunc nisl.
facilitate strategic platforms,Engineering,Nulla justo. Aliquam quis turpis eget elit sodales scelerisque.
transition global infrastructures,Business Development,Duis bibendum.
transition rich platforms,Engineering,"Nullam orci pede, venenatis non, sodales sed, tincidunt eu, felis."
deploy cross-platform methodologies,Sales,Nam dui.
engage cutting-edge technologies,Services,"Donec ut mauris eget massa tempor convallis. Nulla neque libero, convallis eget, eleifend luctus, ultricies eu, nibh."
streamline dynamic relationships,Accounting,"Duis bibendum, felis sed interdum venenatis, turpis enim blandit mi, in porttitor pede justo eu massa. Donec dapibus."
recontextualize B2C users,Business Development,"Lorem ipsum dolor sit amet, consectetuer adipiscing elit. Proin risus."
monetize world-class web services,Product Management,"Morbi vestibulum, velit id pretium iaculis, diam erat fermentum justo, nec condimentum neque sapien placerat ante."
morph integrated networks,Support,Maecenas ut massa quis augue luctus tincidunt. Nulla mollis molestie lorem.
drive innovative interfaces,Legal,Donec ut mauris eget massa tempor convallis.
transform clicks-and-mortar niches,Accounting,Integer ac neque. Duis bibendum.
utilize ubiquitous synergies,Sales,In hac habitasse platea dictumst.
streamline 24/365 communities,Accounting,"Donec diam neque, vestibulum eget, vulputate ut, ultrices vel, augue."
grow back-end partnerships,Research and Development,Maecenas rhoncus aliquam lacus.
architect world-class content,Marketing,Duis mattis egestas metus. Aenean fermentum.
target rich metrics,Support,Aenean auctor gravida sem.
matrix best-of-breed schemas,Accounting,"Mauris enim leo, rhoncus sed, vestibulum sit amet, cursus id, turpis."
optimize customized infomediaries,Legal,Aliquam sit amet diam in magna bibendum imperdiet.
expedite compelling methodologies,Services,Vivamus tortor.
morph synergistic e-commerce,Research and Development,"Integer aliquet, massa id lobortis convallis, tortor risus dapibus augue, vel accumsan tellus nisi eu orci. Mauris lacinia sapien quis libero."
generate best-of-breed infrastructures,Services,Curabitur gravida nisi at nibh.
synergize clicks-and-mortar systems,Research and Development,Cras in purus eu magna vulputate luctus.
orchestrate dynamic models,Engineering,Maecenas rhoncus aliquam lacus.
morph e-business e-business,Sales,"Aliquam augue quam, sollicitudin vitae, consectetuer eget, rutrum at, lorem. Integer tincidunt ante vel ipsum."
evolve enterprise networks,Sales,Proin risus.
implement impactful supply-chains,Support,"Vestibulum quam sapien, varius ut, blandit non, interdum in, ante."
embrace dynamic experiences,Legal,"Fusce lacus purus, aliquet at, feugiat non, pretium quis, lectus."
revolutionize e-business functionalities,Engineering,In hac habitasse platea dictumst.
iterate turn-key models,Human Resources,"Integer pede justo, lacinia eget, tincidunt eget, tempus vel, pede."
leverage clicks-and-mortar web services,Legal,Aenean auctor gravida sem. Praesent id massa id nisl venenatis lacinia.
expedite magnetic web-readiness,Legal,In eleifend quam a odio. In hac habitasse platea dictumst.
unleash collaborative functionalities,Product Management,Integer ac neque.
unleash e-business infomediaries,Marketing,Sed accumsan felis. Ut at dolor quis odio consequat varius.
repurpose cross-platform bandwidth,Legal,Etiam justo. Etiam pretium iaculis justo.
morph viral networks,Product Management,Aenean sit amet justo. Morbi ut odio.
engineer robust technologies,Research and Development,"Nulla ac enim. In tempor, turpis nec euismod scelerisque, quam turpis adipiscing lorem, vitae mattis nibh ligula nec sem."
cultivate sticky functionalities,Services,Fusce posuere felis sed lacus.
strategize holistic architectures,Accounting,Morbi non quam nec dui luctus rutrum. Nulla tellus.
scale rich e-markets,Services,Proin risus.
deploy user-centric experiences,Support,Sed vel enim sit amet nunc viverra dapibus.
whiteboard B2B solutions,Services,Etiam justo. Etiam pretium iaculis justo.
mesh bricks-and-clicks e-markets,Sales,Curabitur at ipsum ac tellus semper interdum. Mauris ullamcorper purus sit amet nulla.
revolutionize viral relationships,Human Resources,Vivamus tortor. Duis mattis egestas metus.
morph vertical schemas,Human Resources,"Maecenas leo odio, condimentum id, luctus nec, molestie sed, justo."
deliver frictionless e-commerce,Business Development,Curabitur in libero ut massa volutpat convallis.
generate plug-and-play e-business,Human Resources,"Donec ut mauris eget massa tempor convallis. Nulla neque libero, convallis eget, eleifend luctus, ultricies eu, nibh."
empower revolutionary convergence,Services,Etiam justo.
leverage sticky systems,Marketing,Donec posuere metus vitae ipsum.
leverage collaborative action-items,Product Management,"Lorem ipsum dolor sit amet, consectetuer adipiscing elit. Proin risus."
monetize intuitive web-readiness,Support,"Vestibulum ac est lacinia nisi venenatis tristique. Fusce congue, diam id ornare imperdiet, sapien urna pretium nisl, ut volutpat sapien arcu sed augue."
scale web-enabled technologies,Engineering,"Morbi odio odio, elementum eu, interdum eu, tincidunt in, leo. Maecenas pulvinar lobortis est."
reinvent proactive technologies,Business Development,"Maecenas tristique, est et tempus semper, est quam pharetra magna, ac consequat metus sapien ut nunc."
target synergistic e-services,Accounting,Nullam molestie nibh in lectus.
exploit back-end systems,Marketing,In hac habitasse platea dictumst.
productize interactive eyeballs,Business Development,Donec ut mauris eget massa tempor convallis.
productize front-end networks,Engineering,In sagittis dui vel nisl. Duis ac nibh.
streamline distributed architectures,Support,In blandit ultrices enim.
repurpose extensible niches,Engineering,Cras non velit nec nisi vulputate nonummy. Maecenas tincidunt lacus at velit.
visualize one-to-one ROI,Legal,"Fusce lacus purus, aliquet at, feugiat non, pretium quis, lectus. Suspendisse potenti."
orchestrate sticky portals,Engineering,Nam dui.
incubate B2C supply-chains,Product Management,Donec ut dolor.
optimize strategic metrics,Engineering,Quisque id justo sit amet sapien dignissim vestibulum.
disintermediate distributed vortals,Services,Proin risus. Praesent lectus.
synthesize front-end infomediaries,Engineering,"In tempor, turpis nec euismod scelerisque, quam turpis adipiscing lorem, vitae mattis nibh ligula nec sem. Duis aliquam convallis nunc."
architect virtual experiences,Research and Development,Pellentesque ultrices mattis odio. Donec vitae nisi.
incubate virtual relationships,Human Resources,"Mauris enim leo, rhoncus sed, vestibulum sit amet, cursus id, turpis."
generate turn-key systems,Research and Development,Sed vel enim sit amet nunc viverra dapibus. Nulla suscipit ligula in lacus.
facilitate 24/365 web-readiness,Support,Nullam porttitor lacus at turpis. Donec posuere metus vitae ipsum.
maximize real-time interfaces,Support,Nunc rhoncus dui vel sem.
utilize impactful web services,Human Resources,"Morbi vestibulum, velit id pretium iaculis, diam erat fermentum justo, nec condimentum neque sapien placerat ante."
mesh robust systems,Product Management,Aliquam non mauris.
maximize web-enabled niches,Engineering,Mauris lacinia sapien quis libero. Nullam sit amet turpis elementum ligula vehicula consequat.
deploy extensible bandwidth,Legal,"Duis bibendum, felis sed interdum venenatis, turpis enim blandit mi, in porttitor pede justo eu massa."
scale world-class platforms,Marketing,Curabitur gravida nisi at nibh. In hac habitasse platea dictumst.
e-enable granular models,Human Resources,"Aliquam sit amet diam in magna bibendum imperdiet. Nullam orci pede, venenatis non, sodales sed, tincidunt eu, felis."
mesh interactive e-markets,Engineering,Vestibulum ante ipsum primis in faucibus orci luctus et ultrices posuere cubilia Curae; Mauris viverra diam vitae quam.
orchestrate cross-media metrics,Services,Praesent blandit lacinia erat. Vestibulum sed magna at nunc commodo placerat.
reintermediate bricks-and-clicks markets,Services,"Fusce congue, diam id ornare imperdiet, sapien urna pretium nisl, ut volutpat sapien arcu sed augue. Aliquam erat volutpat."
repurpose clicks-and-mortar deliverables,Human Resources,Vestibulum rutrum rutrum neque. Aenean auctor gravida sem.
engineer virtual deliverables,Services,Integer a nibh.
embrace integrated convergence,Engineering,"Phasellus id sapien in sapien iaculis congue. Vivamus metus arcu, adipiscing molestie, hendrerit at, vulputate vitae, nisl."
orchestrate B2B platforms,Business Development,"Cum sociis natoque penatibus et magnis dis parturient montes, nascetur ridiculus mus. Vivamus vestibulum sagittis sapien."
utilize user-centric networks,Product Management,Vestibulum sed magna at nunc commodo placerat. Praesent blandit.
grow frictionless ROI,Training,"Vivamus metus arcu, adipiscing molestie, hendrerit at, vulputate vitae, nisl."
leverage plug-and-play e-services,Product Management,Proin interdum mauris non ligula pellentesque ultrices. Phasellus id sapien in sapien iaculis congue.
maximize global metrics,Accounting,"Nullam orci pede, venenatis non, sodales sed, tincidunt eu, felis."
streamline leading-edge channels,Support,Proin interdum mauris non ligula pellentesque ultrices.
optimize 24/365 platforms,Research and Development,In congue.
incentivize mission-critical functionalities,Marketing,"Aliquam augue quam, sollicitudin vitae, consectetuer eget, rutrum at, lorem."
scale back-end applications,Product Management,Nullam molestie nibh in lectus. Pellentesque at nulla.
disintermediate integrated experiences,Engineering,Nullam varius.
seize impactful markets,Business Development,Cras in purus eu magna vulputate luctus.
transform vertical niches,Product Management,"Integer aliquet, massa id lobortis convallis, tortor risus dapibus augue, vel accumsan tellus nisi eu orci. Mauris lacinia sapien quis libero."
expedite best-of-breed web services,Research and Development,"Vestibulum ante ipsum primis in faucibus orci luctus et ultrices posuere cubilia Curae; Donec pharetra, magna vestibulum aliquet ultrices, erat tortor sollicitudin mi, sit amet lobortis sapien sapien non mi. Integer ac neque."
brand B2C infomediaries,Human Resources,Nulla justo. Aliquam quis turpis eget elit sodales scelerisque.
harness next-generation systems,Sales,"Curabitur in libero ut massa volutpat convallis. Morbi odio odio, elementum eu, interdum eu, tincidunt in, leo."
scale B2C mindshare,Services,"Fusce congue, diam id ornare imperdiet, sapien urna pretium nisl, ut volutpat sapien arcu sed augue. Aliquam erat volutpat."
strategize synergistic interfaces,Accounting,Praesent blandit lacinia erat. Vestibulum sed magna at nunc commodo placerat.
synergize sticky technologies,Marketing,Morbi porttitor lorem id ligula.
drive magnetic users,Services,"Nam nulla. Integer pede justo, lacinia eget, tincidunt eget, tempus vel, pede."
syndicate revolutionary eyeballs,Engineering,"In hac habitasse platea dictumst. Morbi vestibulum, velit id pretium iaculis, diam erat fermentum justo, nec condimentum neque sapien placerat ante."
unleash customized technologies,Legal,"Praesent lectus. Vestibulum quam sapien, varius ut, blandit non, interdum in, ante."
mesh viral experiences,Business Development,Proin at turpis a pede posuere nonummy. Integer non velit.
enable killer content,Sales,Ut at dolor quis odio consequat varius.
syndicate open-source channels,Human Resources,Nunc purus.
extend global eyeballs,Engineering,Nullam varius.
deliver visionary e-business,Accounting,"Donec ut mauris eget massa tempor convallis. Nulla neque libero, convallis eget, eleifend luctus, ultricies eu, nibh."
visualize dynamic networks,Accounting,Praesent id massa id nisl venenatis lacinia. Aenean sit amet justo.
synthesize virtual infomediaries,Research and Development,Proin interdum mauris non ligula pellentesque ultrices. Phasellus id sapien in sapien iaculis congue.
utilize synergistic initiatives,Marketing,Maecenas tincidunt lacus at velit.
drive bleeding-edge relationships,Sales,Etiam vel augue. Vestibulum rutrum rutrum neque.
architect plug-and-play bandwidth,Accounting,"Vestibulum ante ipsum primis in faucibus orci luctus et ultrices posuere cubilia Curae; Donec pharetra, magna vestibulum aliquet ultrices, erat tortor sollicitudin mi, sit amet lobortis sapien sapien non mi."
harness one-to-one infrastructures,Accounting,Curabitur in libero ut massa volutpat convallis.
enable world-class markets,Human Resources,Pellentesque eget nunc.
revolutionize proactive infomediaries,Research and Development,Sed accumsan felis.
engineer revolutionary communities,Training,Pellentesque at nulla.
orchestrate B2C systems,Business Development,Nunc rhoncus dui vel sem. Sed sagittis.
architect 24/7 vortals,Accounting,"Duis bibendum, felis sed interdum venenatis, turpis enim blandit mi, in porttitor pede justo eu massa."
extend 24/365 mindshare,Accounting,"In est risus, auctor sed, tristique in, tempus sit amet, sem."
generate magnetic e-markets,Support,Duis bibendum. Morbi non quam nec dui luctus rutrum.
synthesize sticky interfaces,Support,"In blandit ultrices enim. Lorem ipsum dolor sit amet, consectetuer adipiscing elit."
engineer efficient partnerships,Research and Development,Etiam pretium iaculis justo. In hac habitasse platea dictumst.
maximize wireless partnerships,Marketing,Fusce consequat. Nulla nisl.
empower back-end convergence,Business Development,"Proin leo odio, porttitor id, consequat in, consequat ut, nulla."
maximize extensible partnerships,Human Resources,Curabitur convallis.
grow mission-critical communities,Business Development,Cras pellentesque volutpat dui.
syndicate synergistic experiences,Engineering,Nulla facilisi. Cras non velit nec nisi vulputate nonummy.
maximize B2B infrastructures,Engineering,In hac habitasse platea dictumst. Maecenas ut massa quis augue luctus tincidunt.
generate synergistic e-commerce,Marketing,In quis justo. Maecenas rhoncus aliquam lacus.
harness real-time systems,Product Management,Curabitur convallis.
utilize extensible models,Sales,Morbi quis tortor id nulla ultrices aliquet.
incentivize strategic metrics,Support,Integer ac leo. Pellentesque ultrices mattis odio.
mesh innovative portals,Marketing,Maecenas pulvinar lobortis est.
deploy magnetic markets,Legal,Donec ut dolor.
repurpose end-to-end schemas,Product Management,Vestibulum sed magna at nunc commodo placerat.
syndicate clicks-and-mortar infrastructures,Support,Proin at turpis a pede posuere nonummy.
engage next-generation portals,Accounting,"Vestibulum ante ipsum primis in faucibus orci luctus et ultrices posuere cubilia Curae; Donec pharetra, magna vestibulum aliquet ultrices, erat tortor sollicitudin mi, sit amet lobortis sapien sapien non mi. Integer ac neque."
transform scalable interfaces,Product Management,In quis justo. Maecenas rhoncus aliquam lacus.
seize visionary relationships,Sales,Praesent blandit lacinia erat. Vestibulum sed magna at nunc commodo placerat.
incubate innovative systems,Training,Duis mattis egestas metus.
e-enable plug-and-play applications,Product Management,Aliquam erat volutpat.
redefine viral paradigms,Legal,"Donec odio justo, sollicitudin ut, suscipit a, feugiat et, eros."
matrix e-business experiences,Product Management,"Nam nulla. Integer pede justo, lacinia eget, tincidunt eget, tempus vel, pede."
redefine e-business content,Training,Nunc purus.
revolutionize cross-media infrastructures,Product Management,Integer ac leo.
maximize sticky paradigms,Human Resources,"In tempor, turpis nec euismod scelerisque, quam turpis adipiscing lorem, vitae mattis nibh ligula nec sem. Duis aliquam convallis nunc."
cultivate wireless architectures,Services,"Duis bibendum, felis sed interdum venenatis, turpis enim blandit mi, in porttitor pede justo eu massa."
productize virtual e-services,Services,Proin at turpis a pede posuere nonummy. Integer non velit.
engage integrated metrics,Research and Development,Morbi porttitor lorem id ligula.
redefine B2C ROI,Engineering,In sagittis dui vel nisl.
synergize plug-and-play platforms,Marketing,"Cras mi pede, malesuada in, imperdiet et, commodo vulputate, justo. In blandit ultrices enim."
empower turn-key methodologies,Legal,In congue.
architect vertical supply-chains,Product Management,Ut tellus.
strategize sexy markets,Sales,Pellentesque viverra pede ac diam. Cras pellentesque volutpat dui.
innovate integrated users,Product Management,Integer ac leo. Pellentesque ultrices mattis odio.
morph turn-key solutions,Legal,Suspendisse potenti. Nullam porttitor lacus at turpis.
architect plug-and-play e-markets,Business Development,"Quisque erat eros, viverra eget, congue eget, semper rutrum, nulla."
grow turn-key portals,Marketing,"Maecenas tristique, est et tempus semper, est quam pharetra magna, ac consequat metus sapien ut nunc."
enable collaborative systems,Legal,"Cum sociis natoque penatibus et magnis dis parturient montes, nascetur ridiculus mus."
grow B2B convergence,Training,"Nulla neque libero, convallis eget, eleifend luctus, ultricies eu, nibh."
brand holistic applications,Accounting,Duis mattis egestas metus.
leverage leading-edge infomediaries,Sales,Cras non velit nec nisi vulputate nonummy. Maecenas tincidunt lacus at velit.
syndicate viral infomediaries,Services,Mauris lacinia sapien quis libero.
unleash leading-edge interfaces,Legal,Donec semper sapien a libero. Nam dui.
